,subreddit,Pid,title,upvote,date
0,CoronavirusUS,g0d7dm,Daily Q&A - Ask + Answer Questions Here,16,2020-04-13 06:06:58
1,CoronavirusUS,g1sv1k,Stimulus/Financial/Economic Questions - Ask + Answer HERE,11,2020-04-15 14:23:19
2,CoronavirusUS,g23rbv,History doesn’t lie,753,2020-04-15 23:49:00
3,CoronavirusUS,g1u6gz,"More than 600,000 people sign petition demanding hazard pay for U.S. Postal Service employees",1057,2020-04-15 15:32:03
4,CoronavirusUS,g202da,Donald Trump names WWE’s Vince McMahon as adviser to restart US economy,112,2020-04-15 20:29:04
5,CoronavirusUS,g1rmbw,"Best Buy stores just laid off 51,000 people due to COVID. All part time workers and 20% of their full timers. Corporate staff are taking 20%-50% pay cut. Most employees have not even been told yet that their last day is Saturday and had to find out from an article posted online.",286,2020-04-15 13:11:03
6,CoronavirusUS,g1x5ce,Wilmington Hospital nurse walks off job after being forbidden from wearing N95 mask to treat COVID-19 patients,110,2020-04-15 18:01:15
7,CoronavirusUS,g236ri,Steve Mnuchin states that the stimulus package should support Americans for 10 weeks.,33,2020-04-15 23:17:40
8,CoronavirusUS,g247jz,A mother in New York was cheered on by hospital staff as she met her newborn baby after recovering from coronavirus. She spent 11 days on a ventilator,29,2020-04-16 00:15:56
9,CoronavirusUS,g23qfp,Protestors against the stay-at-home order in Michigan block streets leading to Sparrow Hospital,33,2020-04-15 23:47:36
10,CoronavirusUS,g22o1o,Los Angeles mayor says large gatherings like concerts and sporting events may not come back until 2021,33,2020-04-15 22:48:58
11,CoronavirusUS,g1y56z,"One month ago today, there were a total of 62 confirmed COVID-19 deaths in the U.S. -- as of right now, that number is 27,586, undoubtedly with thousands more deaths that have not been confirmed",62,2020-04-15 18:51:14
12,CoronavirusUS,g20191,Why Are Rich Americans Getting $1.7 Million Stimulus Checks?,49,2020-04-15 20:27:28
13,CoronavirusUS,g1q5bi,Bill Gates says Trump's decision to halt WHO funding is 'as dangerous as it sounds,227,2020-04-15 11:27:39
14,CoronavirusUS,g1tu7j,(US) Is there a website to anonymously name companies who screw/take advantage of workers during the outbreak?,95,2020-04-15 15:14:36
15,CoronavirusUS,g20nz8,"Atlanta police searching for woman who filmed herself coughing on family of 6, possibly as part of a ‘social media challenge’",29,2020-04-15 21:01:29
16,CoronavirusUS,g22peg,"Coronavirus cases at South Dakota meatpacking plant surpass 540, make up 55 percent of all cases in the state",21,2020-04-15 22:51:02
17,CoronavirusUS,g22y07,2 million slaughtered chickens can’t be sold during coronavirus pandemic,20,2020-04-15 23:04:03
18,CoronavirusUS,g22tjo,The economic data is even worse than Wall Street feared: 'The economy is clearly in ruins here',18,2020-04-15 22:57:12
19,CoronavirusUS,g2328p,Social Distancing and Seriouness of this Situation,17,2020-04-15 23:10:32
20,CoronavirusUS,g21zbu,"U.S. coronavirus deaths top 30,000",19,2020-04-15 22:11:26
21,CoronavirusUS,g26c25,New York to require all people to wear masks when in public,8,2020-04-16 02:29:38
22,CoronavirusUS,g1ppjo,Americans are not seeing the same coronavirus news,131,2020-04-15 10:51:41
23,CoronavirusUS,g1sfcy,Tennessee keeps nursing homes' COVID-19 numbers secret,70,2020-04-15 13:58:58
24,CoronavirusUS,g1xer8,"Secretary of Defense Press Conference: ""On the T.R., of 585 sailors, only 213 were symptomatic."" That means 63.6% of those who tested positive showed no symptoms.",33,2020-04-15 18:13:46
25,CoronavirusUS,g20zs8,Gov. Hogan of Maryland issues an Executive Order mandating the use of face coverings in public settings.,17,2020-04-15 21:18:48
26,CoronavirusUS,g1zb4t,Plans to reopen Texas will be announced on Friday,22,2020-04-15 19:50:18
27,CoronavirusUS,g1x1fl,US farmers estimated to lose $20 billion in 2020 due to coronavirus crisis,29,2020-04-15 17:56:14
28,CoronavirusUS,g1po3q,First March Without School Shooting Since 2002,113,2020-04-15 10:48:37
29,CoronavirusUS,g20wdr,"We Alerted The World' To Coronavirus On Jan. 5, WHO Says In Response To U.S.",15,2020-04-15 21:13:42
30,CoronavirusUS,g260wl,It's a bit complicated': Delayed COVID-19 test results make it difficult to understand the spread in Arizona,6,2020-04-16 02:09:04
31,CoronavirusUS,g1fzjm,Antivaxers,859,2020-04-14 23:03:13
32,CoronavirusUS,g22zrv,"John Hopkins now has county-by-county presentation for USA, superior to most state dashboards",10,2020-04-15 23:06:42
33,CoronavirusUS,g1xdx2,Honking cars lined up for miles protesting governor Whitmer by the Capitol Building in Lansing Michigan.,25,2020-04-15 18:12:35
34,CoronavirusUS,g24i9t,Lake Tahoe: all national forest recreation areas and sites in the South Shore Recreation Corridors are now closed. Been too crowded. People were told not to go there - and they didn't listen...,7,2020-04-16 00:33:40
35,CoronavirusUS,g20bdz,Company forced to kill up to 2M chickens that won't reach market due to staffing shortages,14,2020-04-15 20:42:29
36,CoronavirusUS,g257cp,Los Angeles mayor says large gatherings like concerts and sporting events may not come back until 2021,6,2020-04-16 01:16:16
37,CoronavirusUS,g22v3l,Free COVID-19 tests for all Tennesseans available starting Saturday,9,2020-04-15 22:59:32
38,CoronavirusUS,g1w1xb,NC Small Business owners protest against containment measures. The sad truth may be that it's not the measures that keep their businesses shut or down. Till consumers feel confident it's safe to get back to normal many SBs will have no customers. And that may be for a LONG time from now,26,2020-04-15 17:06:39
39,CoronavirusUS,g23nyu,Protesters clog streets in Michigan over Whitmer coronavirus stay-home order,6,2020-04-15 23:43:41
40,CoronavirusUS,g1sapq,"Here's how the virus spreads if everyone visits ""just one friend""",43,2020-04-15 13:51:37
41,CoronavirusUS,g21h4t,The tech ‘solutions’ for coronavirus take the surveillance state to the next level,9,2020-04-15 21:44:38
42,CoronavirusUS,g23vht,Protestors against the stay-at-home order in Michigan block streets leading to Sparrow Hospital,6,2020-04-15 23:55:42
43,CoronavirusUS,g1twfu,Stimulus Check could be delayed so that Trump’s name can be printed on them.,32,2020-04-15 15:17:52
44,CoronavirusUS,g25wcx,Arizona Department of Corrections not releasing number of positive tests of officers,3,2020-04-16 02:00:59
45,CoronavirusUS,g1ps5g,"Check on the status of your Economic Impact Payment This application will give you information about: Your payment status Your payment type Whether we need more information from you, including bank account information",58,2020-04-15 10:57:53
46,CoronavirusUS,g1qcst,Prominent scientists have bad news for the White House about coronavirus antibody tests,53,2020-04-15 11:43:45
47,CoronavirusUS,g242a3,"What's up with S. Dakota? Are they just not reporting numbers now? Been like this for a while, it seems unbelievable to me that people are not dying.",4,2020-04-16 00:06:57
48,CoronavirusUS,g213oc,"Mayor Goodman calls shutdown ‘total insanity,’ wants businesses reopened",9,2020-04-15 21:24:48
49,CoronavirusUS,g26jqk,"Finally, large scale trustworthy antibody tests are here!",3,2020-04-16 02:43:58
50,CoronavirusUK,flqx6w,"Mega Mod Thread: Advice, FAQs, Rules and Announcments - Regularly Updated",45,2020-03-20 07:30:54
51,CoronavirusUK,g2510c,"Daily Discussion Megathread - April 16 | Questions, images, videos, comments, unconfirmed reports, theories, suggestions",1,2020-04-16 01:05:15
52,CoronavirusUK,g1ovpm,Just had a free food parcel delivered from the government due to being 'at risk'!,895,2020-04-15 09:43:30
53,CoronavirusUK,g2185o,Care home reality,55,2020-04-15 21:31:31
54,CoronavirusUK,g1swj4,"14th April - UK's daily death toll compared with Italy's, Spain's, France's and Germany's",142,2020-04-15 14:25:35
55,CoronavirusUK,g1qagh,On a positive note my mum just got her first weekly care package as she’s considered a vulnerable adult and I’ve also been granted furlough by my employer - words can’t express how grateful we both are that the UK government is taking steps towards looking out for people at a time like this,169,2020-04-15 11:38:50
56,CoronavirusUK,g1tdwl,"April 15 NHS England deaths by actual day chart, now including ONS data",84,2020-04-15 14:51:24
57,CoronavirusUK,g1x8pl,Lockdown and alcohol consumption?,38,2020-04-15 18:05:34
58,CoronavirusUK,g1nxkh,"UK was too slow to act on COVID-19 initially, opposition Labour leader says",195,2020-04-15 08:24:17
59,CoronavirusUK,g225rz,Matt Hancock says lack of testing is down to “not enough demand”,15,2020-04-15 22:21:06
60,CoronavirusUK,g1wnb6,Great-grandma of 106 is 'UK's oldest coronavirus survivor',26,2020-04-15 17:36:44
61,CoronavirusUK,g1ym5p,"My friend is suffering from a severe case of coronavirus, what can I do to make his days a little better?",18,2020-04-15 19:14:39
62,CoronavirusUK,g1rza6,"Cases down and deaths lower from yesterday,hopefully this trend continues",48,2020-04-15 13:33:06
63,CoronavirusUK,g236tv,How healthcare workers de-stress during the coronavirus outbreak,7,2020-04-15 23:17:46
64,CoronavirusUK,g1ydtg,"Army veteran, 99, raises £4m for 'humbled' NHS",16,2020-04-15 19:03:12
65,CoronavirusUK,g1tcx7,A nice metaphor regarding the logic of easing the lockdown,37,2020-04-15 14:49:58
66,CoronavirusUK,g1utg3,'Blanket' use of Do Not Resuscitate notices in care homes forbidden,27,2020-04-15 16:03:42
67,CoronavirusUK,g1nt3e,So this happened on Good Morning Britain just now.,108,2020-04-15 08:13:33
68,CoronavirusUK,g1r70p,Why has the dialogue changed so suddenly?,41,2020-04-15 12:43:13
69,CoronavirusUK,g1udlj,Three-week extension to NI coronavirus lockdown,21,2020-04-15 15:41:46
70,CoronavirusUK,g23be2,UK retail sales drop by a quarter in first two weeks of lockdown,5,2020-04-15 23:24:45
71,CoronavirusUK,g1s9qe,There has been a considerable rise in Non-Covid related Home and Care Home deaths in Scotland,28,2020-04-15 13:50:06
72,CoronavirusUK,g235d1,"Three temporary mortuaries to be installed in Sussex. The largest of which will be at my old uni, the University of Sussex",5,2020-04-15 23:15:30
73,CoronavirusUK,g1yqyr,"Coronavirus: Pregnant nurse, 28, dies after contracting COVID-19 - but baby survives",11,2020-04-15 19:21:30
74,CoronavirusUK,g1y1qo,UK lockdown set to be extended until early May,12,2020-04-15 18:46:14
75,CoronavirusUK,g1z9a1,Our daughters appreciation for our milkman,8,2020-04-15 19:47:30
76,CoronavirusUK,g1zln2,Coronavirus: Covid-19 diagnosed in 11-week-old baby,8,2020-04-15 20:05:31
77,CoronavirusUK,g21dai,Warning as coronavirus outbreak leads to sharp rise in deaths at home.,5,2020-04-15 21:38:57
78,CoronavirusUK,g1tas2,Hackers Leak Thousands of Coronavirus Research Papers,21,2020-04-15 14:46:45
79,CoronavirusUK,g250lr,"Fatality per capita in England is more than double that of Scotland, Wales or Norther Ireland. UK is now the forth highest affected country in Europe.",3,2020-04-16 01:04:33
80,CoronavirusUK,g1scne,Difficult to think that this was 5th March. So much has changed.,23,2020-04-15 13:54:38
81,CoronavirusUK,g2305l,"Pregnant NHS nurse, 28, dies of coronavirus but baby is saved after c-section",4,2020-04-15 23:07:18
82,CoronavirusUK,g1zi2y,Crime in UK falls sharply since start of coronavirus lockdown,6,2020-04-15 20:00:18
83,CoronavirusUK,g1s4ff,Stats 15/04,21,2020-04-15 13:41:35
84,CoronavirusUK,g1riul,New UK deaths announced 15th April 2020,25,2020-04-15 13:04:51
85,CoronavirusUK,g22gmn,Any UK NHS workers in need of KN95 (FFP2) masks?,4,2020-04-15 22:37:43
86,CoronavirusUK,g21107,Church of England moves valuables to Tower of London amid fears of looting,4,2020-04-15 21:20:45
87,CoronavirusUK,g1zjwh,"Father-of-eight dies of coronavirus aged just 34 after believing he had recovered from the killer infection as well-wishers raise more than £90,000 for his devastated family",6,2020-04-15 20:02:59
88,CoronavirusUK,g25v3t,7 day rolling average cases and deaths. Suggests UK wont reach its peak (Deaths)for a while as confirmed cases are still rising,2,2020-04-16 01:58:38
89,CoronavirusUK,g25clq,"Created a 3D animation to help everyone stay safe from Covid 19, feedback is appreciated!",2,2020-04-16 01:25:32
90,CoronavirusUK,g1pgwh,I got tested this morning- some thoughts,27,2020-04-15 10:32:42
91,CoronavirusUK,g258l9,Coronavirus Group Chat,2,2020-04-16 01:18:19
92,CoronavirusUK,g1s1p2,"Woman, 106, believed to be UK's oldest patient to recover from COVID-19 leaves hospital",17,2020-04-15 13:37:02
93,CoronavirusUK,g24vlf,Help researchers understand how the COVID-19 Pandemic is affecting you!,2,2020-04-16 00:55:53
94,CoronavirusUK,g1u3yl,"Long-term recovery (fatigue, mild symptoms)",11,2020-04-15 15:28:35
95,CoronavirusUK,g1tuvi,I've just received a letter (dated 23 March!) stating I am 'at a higher risk' due to health conditions etc. This is jointly from my council and CCG. Does this mean I'm in the shielding group or did they send letters to the vunerable group (i.e. the flu shot lot) as well. I'm confused.,12,2020-04-15 15:15:35
96,CoronavirusUK,g23r6c,Anyone else having these awful thoughts and feelings?,2,2020-04-15 23:48:45
97,CoronavirusUK,g1rmvf,"""All patients being discharged from hospital into a care home will now automatically be tested for coronavirus, the spokesman said""",14,2020-04-15 13:11:59
98,CoronavirusUK,g276lz,Interesting,1,2020-04-16 03:26:53
99,CoronavirusUK,g272x6,"Real-Time Information for Covid -19 done by University of New Haven, USA",1,2020-04-16 03:20:02
100,CoronavirusNewYork,fc37iz,Welcome to r/CoronavirusNewYork,49,2020-03-02 00:02:57
101,CoronavirusNewYork,fypli8,User-Flairs Update,6,2020-04-10 21:45:58
102,CoronavirusNewYork,g23ecx,"""Capitalism is the Virus"" graffiti in New Orleans",25,2020-04-15 23:29:21
103,CoronavirusNewYork,g1udvo,"Most New York City children 'probably' have coronavirus, doc says",67,2020-04-15 15:42:08
104,CoronavirusNewYork,g260y6,Exclusive: New York taps McKinsey to develop 'Trump-proof' economic reopening plan,7,2020-04-16 02:09:07
105,CoronavirusNewYork,g262k6,"All NYC Subways, Buses & Ferries Will Blast Horns In Solidarity With Transportation Workers This Thursday - Secretnyc",7,2020-04-16 02:12:01
106,CoronavirusNewYork,g25uuz,Intelligence officials weigh possibility coronavirus escaped from a Chinese lab,7,2020-04-16 01:58:11
107,CoronavirusNewYork,g25o23,MIT study: Subways a 'major disseminator' of coronavirus in NYC,5,2020-04-16 01:45:52
108,CoronavirusNewYork,g25jk9,"U.S. Military Investigations Suggest COVID-19 Probably Wasn't Created in a Lab, Chairman of Joint Chief Says",5,2020-04-16 01:37:47
109,CoronavirusNewYork,g22q2a,For those able to #serve: NYC Health + Hospitals is looking to fill 500 non-clinical positions immediately including:,8,2020-04-15 22:52:05
110,CoronavirusNewYork,g20dc3,Mourning a 'supermom': U.S. health worker casualties mount in virus fight,10,2020-04-15 20:45:27
111,CoronavirusNewYork,g20y6b,Will Upstate NY be back to work and school by May? Low infection rates etc.,7,2020-04-15 21:16:19
112,CoronavirusNewYork,g26b13,"Who thinks this is a golden opportunity for Future to remix ""Mask Off"" to Mask On",2,2020-04-16 02:27:44
113,CoronavirusNewYork,g1xhgo,Cuomo update summary 4/15,8,2020-04-15 18:17:34
114,CoronavirusNewYork,g23qq1,Medical device “jailbreak” could help solve the dangerous shortage of ventilators,2,2020-04-15 23:48:02
115,CoronavirusNewYork,g275ka,Idk if I’m stressing out for no reason or what.,1,2020-04-16 03:24:55
116,CoronavirusNewYork,g214jx,When do you think Gov Cuomo announce extension of school and non-essential biz closures beyond April 29th?,3,2020-04-15 21:26:10
117,CoronavirusNewYork,g1w6n3,Invite a goat to your corporate meeting to help out a farm,7,2020-04-15 17:13:24
118,CoronavirusNewYork,g26dcw,"ncov19 | Coronavirus COVID-19 Tracker with Testing Centers, SARS-COV-2 Vaccine Information, and SMS notification.",1,2020-04-16 02:32:09
119,CoronavirusNewYork,g1vapp,NYC may return to ‘normal’ by September: de Blasio - New York Daily News,6,2020-04-15 16:28:29
120,CoronavirusNewYork,g1sfl8,Where are you getting cleaning supplies?,9,2020-04-15 13:59:19
121,CoronavirusNewYork,g25k6p,"Created a 3D animation to help everyone stay safe from Covid 19, feedback is appreciated!",1,2020-04-16 01:38:58
122,CoronavirusNewYork,g1cz6w,Taiwan crowdfunds to post message to New York,192,2020-04-14 20:14:27
123,CoronavirusNewYork,g1u9jh,Loving this video by the FDNY thanking our health care workers. #newyorktough,5,2020-04-15 15:36:16
124,CoronavirusNewYork,g1u553,"Five months on, what scientists now know about the coronavirus | World news | The Guardian",4,2020-04-15 15:30:14
125,CoronavirusNewYork,g1t1x0,Banks authorized to grab stimulus checks off their customers,5,2020-04-15 14:33:29
126,CoronavirusNewYork,g1jb4n,13.5% of maternity patients tested COVID+,35,2020-04-15 02:30:51
127,CoronavirusNewYork,g1lzt2,"No Guarantee NYC Schools Will Reopen In September, Mayor Says | New York City, NY Patch",16,2020-04-15 05:48:06
128,CoronavirusNewYork,g1v3wh,“The fastest an answer can possibly come we think is in two months.” : US clinical trials of hydroxychloroquine hit 'warp speed',2,2020-04-15 16:18:22
129,CoronavirusNewYork,g1zc8m,Face makes to be required where social distancing not possible,0,2020-04-15 19:51:52
130,CoronavirusNewYork,g1e03k,"BREAKING: New York City links 3,778 additional deaths to coronavirus under new criteria, raising city's total to 11,683",57,2020-04-14 21:12:40
131,CoronavirusNewYork,g1tz1o,Why stock-market investors may be asking the ‘wrong question’ about coronavirus and reopening the economy - MarketWatch,2,2020-04-15 15:21:43
132,CoronavirusNewYork,g1ea0v,the rich live while the poor suffer. capitalist culture is worsening the virus.,50,2020-04-14 21:28:02
133,CoronavirusNewYork,g1sst5,"CDC Director reacts to trump blaming WHO, Dr. Robert Redfield addresses the president's decision to cut funding to the world health organisation as well as states working to ease restrictions and the key to preventing a second wave.",2,2020-04-15 14:19:51
134,CoronavirusNewYork,g1j0hb,"New York, California lawmakers call for state ban on 'wet markets' amid coronavirus",18,2020-04-15 02:10:56
135,CoronavirusNewYork,g1ncqq,Food dying on the vine due to supply-chain shutdown amid the novel coronavirus pandemic.,7,2020-04-15 07:36:21
136,CoronavirusNewYork,g25gnd,Where to sell 3M N95 1860 masks? Also is anyone in need of them?,0,2020-04-16 01:32:46
137,CoronavirusNewYork,g1v52o,New York State Unemployment Call Back info,1,2020-04-15 16:20:07
138,CoronavirusNewYork,g1u9os,"Social distancing may be necessary until 2022 unless a treatment or vaccine is developed, study says (link to peer reviewed journal)",0,2020-04-15 15:36:26
139,CoronavirusNewYork,g1739g,"Doctors in the United States have been placing ventilated ARDS patients on their stomachs. Now they've doubled down on this with coronavirus patients, and it's paying off.",83,2020-04-14 15:01:16
140,CoronavirusNewYork,g1i9wq,What kinds of things will offices need to do to reopen?,8,2020-04-15 01:22:45
141,CoronavirusNewYork,g1dlwf,"NYC Health Dept. confirms 10,367 have died of coronavirus in five boroughs",19,2020-04-14 20:51:20
142,CoronavirusNewYork,g1ve2k,"Trump Cancels W.H.O. Coronavirus funding, 2,011,000 COVID-19 Cases!",0,2020-04-15 16:33:21
143,CoronavirusNewYork,g1fe28,Our Pandemic Summer: The fight against the coronavirus won’t be over when the U.S. reopens. Here’s how the nation must prepare itself.,8,2020-04-14 22:29:13
144,CoronavirusNewYork,g1c4sh,Trump Accuses Governors of ‘Mutiny’ in Coronavirus Power Struggle,16,2020-04-14 19:29:59
145,CoronavirusNewYork,g1f4gy,Where is the claim benefits option? I finally received a call last Sunday the lady told me I can go to my account every Sunday and claim my weekly payment but I’m checking my account now and that option still isn’t showing..,10,2020-04-14 22:14:22
146,CoronavirusNewYork,g1ot7p,"President Trump criticises World Health Organisation on covid-19 pandemic, announces to halt funding. The US is the largest donor to the WHO by far and makes its contribution annually.",1,2020-04-15 09:37:36
147,CoronavirusNewYork,g1xkug,Very important Update Coronavirus in New York +7177 on 14-05,0,2020-04-15 18:22:26
148,CoronavirusNewYork,g18b5m,Cuomo update summary 4/14,18,2020-04-14 16:06:42
149,CoronavirusNewYork,g1ah82,Gov. Cuomo: ‘I Believe the Worst Is Over if We Continue To Be Smart’,9,2020-04-14 18:02:05
150,CoronavirusCA,g1mzli,"*Daily* Check-in/Personal Thread - April 15, 2020: Concerns, Vents, Questions, Anecdotes, Personal Preparation",3,2020-04-15 07:07:23
151,CoronavirusCA,g1bfoa,"Megathread: Gavin Newsom to discuss California's ""incremental release of the stay-at-home orders""",249,2020-04-14 18:53:49
152,CoronavirusCA,g21klk,California offering $500 in coronavirus relief to undocumented immigrants,316,2020-04-15 21:49:54
153,CoronavirusCA,g1uho2,Place to donate stimulus check?,223,2020-04-15 15:47:19
154,CoronavirusCA,g22o1j,Santa Clara County—Not S.F.—Was Ahead of the Curve with Public Health Mandate,32,2020-04-15 22:48:58
155,CoronavirusCA,g1t3bd,"Check here for the status on your stimulus check, or update bank info! Get My Payment just went live today",132,2020-04-15 14:35:33
156,CoronavirusCA,g1yzkq,Re-opening California and Potential Increase in Cases,49,2020-04-15 19:33:36
157,CoronavirusCA,g1vtlg,California Releases Post-Coronavirus Plan for Restaurants | Food & Wine,39,2020-04-15 16:55:23
158,CoronavirusCA,g21o9q,Santa Cruz County may ease shelter-in-place restrictions May 4,13,2020-04-15 21:55:16
159,CoronavirusCA,g1wdog,Per the request...I’ve mapped the daily ‘percentage day over day increase in total deaths’ <orange line> and ‘daily death number’ <blue bars> (5 day average to smooth data),28,2020-04-15 17:23:33
160,CoronavirusCA,g25udg,Why are there no categorizations by age in California?,3,2020-04-16 01:57:17
161,CoronavirusCA,g1iy3y,"New York, California lawmakers call for state ban on 'wet markets' amid coronavirus",269,2020-04-15 02:06:26
162,CoronavirusCA,g27fgw,"CA doing well - plot of deaths/day normalized by population. Also look at Michigan, where people were protesting today against stay at home orders for comparison. (source - http://91-divoc.com/pages/covid-visualization/)",2,2020-04-16 03:43:38
163,CoronavirusCA,g279st,road cleaning truck in Quebec,2,2020-04-16 03:33:05
164,CoronavirusCA,g1u042,What do you think of this article saying we possibly will social distance until 2022?,16,2020-04-15 15:23:09
165,CoronavirusCA,g1yesk,Newsome Press Conference Noon Wed. here,6,2020-04-15 19:04:29
166,CoronavirusCA,g1t0pz,Beware: Banks authorized to grab coronavirus stimulus checks off their customers,16,2020-04-15 14:31:46
167,CoronavirusCA,g1v8mz,"I made a graph of California’s total deaths, where I looked at the overall number’s growth percentage day over day.",8,2020-04-15 16:25:29
168,CoronavirusCA,g1thut,"San Diego County officials give inconsistent, confusing COVID-19 statements",6,2020-04-15 14:57:22
169,CoronavirusCA,g21gjj,"California Fish and Game Commission Meets Remotely, Allows CDFW to Temporarily Delay, Restrict or Suspend Fisheries Where Needed to Prevent the Spread of Coronavirus",2,2020-04-15 21:43:46
170,CoronavirusCA,g1ftwx,Day one of CA state unemployment payments that included an extra $600 a week to cover job losses spawned by the Coronavirus was accompanied by a head-spinning price tag: $336 million in payouts,107,2020-04-14 22:54:23
171,CoronavirusCA,g1qyn8,Coronavirus vaccine update: vaccines being tested on humans says WHO,8,2020-04-15 12:27:16
172,CoronavirusCA,g1m0hp,"All California Courts on limited schedule thru May 12, 2020 pdf",20,2020-04-15 05:49:35
173,CoronavirusCA,g1fmt6,Newsom's prerequistes to reopen California,62,2020-04-14 22:42:46
174,CoronavirusCA,g1hdin,How long has it been here?,38,2020-04-15 00:25:50
175,CoronavirusCA,g1pe34,Anyone self-employed or contractors get unemployment benefits yet?,7,2020-04-15 10:26:23
176,CoronavirusCA,g1fbhq,"San Francisco Pride parade, celebration canceled due to coronavirus crisis",48,2020-04-14 22:25:16
177,CoronavirusCA,g1nvnj,"Peninsula police officer recovers from COVID-19, will donate plasma",10,2020-04-15 08:19:47
178,CoronavirusCA,g1l334,Could I lose my job,11,2020-04-15 04:37:37
179,CoronavirusCA,g1bs15,"The East Coast, Always in the Spotlight, Owes a Debt to the West",61,2020-04-14 19:11:46
180,CoronavirusCA,g18std,"Coronavirus: San Francisco cancels 4/20 celebration, violators will be cited",83,2020-04-14 16:32:57
181,CoronavirusCA,g12n8k,"Newsom Announces Aid for Foster Care Youth Affected by COVID-19, New Agreement With Oregon and Washington",231,2020-04-14 09:47:06
182,CoronavirusCA,g1b31m,Low-Income Angelenos Can Apply for Pre-Paid Debit Cards Starting Today,40,2020-04-14 18:34:58
183,CoronavirusCA,g1j008,SoCal Covid-19 Stats 4/7 - 4/13 (more in comments),8,2020-04-15 02:10:02
184,CoronavirusCA,g16j7h,Here’s how San Diego scientists are mounting a counterattack against the coronavirus.,31,2020-04-14 14:30:06
185,CoronavirusCA,g21gwt,"As worries mount over US food supply chain, now’s the time to prepare for possible shortages.",0,2020-04-15 21:44:20
186,CoronavirusCA,g0qtsu,"Governor Inslee tweets: WA, OR and CA will work together on a shared approach for reopening our economies",659,2020-04-13 20:22:14
187,CoronavirusCA,g15scb,"Fake cures, scams, phony medications and price gouging: Predators pounce during coronavirus",19,2020-04-14 13:45:02
188,CoronavirusCA,g0r3u4,"Washington, Oregon and California announce Western States Pact",203,2020-04-13 20:37:34
