,subreddit,Pid,title,upvote,date
0,CoronavirusUS,g140pa,Homeowners and mortgage lenders brace for coronavirus aftermath,8,2020-04-14 11:42:46
1,CoronavirusUS,g141vy,Pregnant during the pandemic.,26,2020-04-14 11:45:35
2,CoronavirusNewYork,g14312,Coronavirus Tips For Working At Home: Your Work Space,1,2020-04-14 11:48:12
3,CoronavirusUK,g1437f,"I feel like I’m waiting until I inevitably get ill, as a checkout operater in a Tesco supermarket.",101,2020-04-14 11:48:36
4,CoronavirusUS,g145ia,State Department cables warned of safety issues at Wuhan lab studying bat coronaviruses,94,2020-04-14 11:53:35
5,CoronavirusIllinois,g145jn,Coronavirus Tips For Working At Home: Your Work Space,0,2020-04-14 11:53:39
6,CoronavirusUK,g14db0,"""The health of Boris Johnson is the health of the body politic and, by extension, the health of the nation itself"".",0,2020-04-14 12:09:38
7,CoronavirusUK,g14he7,Why are we not reporting the number of recovered patients?,1,2020-04-14 12:18:03
8,CoronavirusNewYork,g14hul,Photos: Rainbow Appears Over NYC As 7 O'Clock Cheer Takes Place - Gothamist,27,2020-04-14 12:19:02
9,CoronavirusUK,g14iok,True total deaths directly and indirectly caused by COVID-10,10,2020-04-14 12:20:47
10,CoronavirusNewYork,g14jy6,Jimi Hendrix tribute during NYC's 7 o'clock cheer - YouTube,7,2020-04-14 12:23:20
11,CoronavirusUS,g14k9x,Bill Protecting Health Care Professionals from Liability While Serving on Frontlines of COVID-19 Efforts Passes Full Assembly (In New Jersey),18,2020-04-14 12:24:02
12,CoronavirusUK,g14o1b,Where does one isolate?,9,2020-04-14 12:31:23
13,CoronavirusUK,g14o53,"Macaque monkeys can't become reinfected with COVID-19, small study suggests.",10,2020-04-14 12:31:33
14,CoronavirusUK,g14oy1,Serological analysis of 1000 Scottish blood donor samples for anti-SARS-CoV-2 antibodies collected in March 2020,18,2020-04-14 12:33:13
15,CoronavirusNewYork,g14rj3,Thanks in advance!,0,2020-04-14 12:38:15
16,CoronavirusUS,g14vyk,Please just give us hazard pay!,961,2020-04-14 12:46:43
17,CoronavirusUK,g151h1,Only 19 patients in Nightingale so far,62,2020-04-14 12:57:10
18,CoronavirusUS,g152vr,"Cuomo says if Trump ordered New York to reopen, he 'wouldn't do it'",535,2020-04-14 12:59:56
19,CoronavirusUS,g159rs,Second wave,13,2020-04-14 13:11:53
20,CoronavirusUK,g15bcr,Don't know if it is entirely COVID-19 but it's kicking my ass so far,9,2020-04-14 13:14:47
21,CoronavirusUS,g15bqi,Protesting in Ohio,5,2020-04-14 13:15:33
22,CoronavirusUK,g15ffo,A letter from a frontline nurse at the UK’s Royal Bournemouth Hospital,8,2020-04-14 13:22:17
23,CoronavirusUK,g15htd,Another 744 die in hospitals in England,16,2020-04-14 13:26:30
24,CoronavirusUK,g15koi,A Comparison Of Lockdown UK With Non-Lockdown Sweden,1,2020-04-14 13:31:46
25,CoronavirusUK,g15lfc,Official numbers,37,2020-04-14 13:33:06
26,CoronavirusUK,g15lpi,"UK Cops Brag About ""Hiding In The Shadows"" To Catch Picnic-Goers",7,2020-04-14 13:33:35
27,CoronavirusUK,g15odg,'I feel fear and guilt': an NHS junior doctor on the effect of getting Covid-19 | World news,22,2020-04-14 13:38:22
28,CoronavirusUS,g15pm9,"Fake cures, scams, phony medications and price gouging: Predators pounce during coronavirus",7,2020-04-14 13:40:23
29,CoronavirusCA,g15scb,"Fake cures, scams, phony medications and price gouging: Predators pounce during coronavirus",19,2020-04-14 13:45:02
30,CoronavirusUS,g15sec,"Scientists at the University of Alberta have shown that the drug remdesivir, drug originally meant for Ebola, is highly effective in stopping the replication mechanism of the coronavirus that causes COVID-19.",10,2020-04-14 13:45:07
31,CoronavirusUK,g15u66,14 April NHS England deaths increase by actual day chart,33,2020-04-14 13:48:20
32,CoronavirusUS,g15uti,Trump Insists He Has ‘Total’ Authority to Supersede Governors,18,2020-04-14 13:49:28
33,CoronavirusUS,g15v2t,"After this, there had BETTER be a push for a $15 Minimum Wage and Mandated Minimum Health Benefits",176,2020-04-14 13:49:56
34,CoronavirusUS,g15xa4,"Wash Your Hands? Despite Pandemic, Thousands Still Have No Water in Detroit, a Coronavirus Hot Spot",54,2020-04-14 13:53:46
35,CoronavirusUS,g15yd7,Is it legal to sue for wrongful exposure?,0,2020-04-14 13:55:35
36,CoronavirusUS,g15zgz,[04.13.2020] Updated COVID-19 Predictions for the USA,2,2020-04-14 13:57:36
37,CoronavirusNewYork,g1637k,COVID-19 Live Statistics Dashboard,2,2020-04-14 14:04:03
38,CoronavirusUK,g167ef,Daily exercise...,4,2020-04-14 14:11:02
39,CoronavirusUS,g167nu,I work for a psychiatry clinic and they wanted me to spread the word about a free tele-psychiatry appt to people in IL bc of COVID,22,2020-04-14 14:11:30
40,CoronavirusIllinois,g1688b,I work for a psychiatry clinic and they wanted me to spread the word about a free tele-psychiatry appt to people in IL bc of COVID,31,2020-04-14 14:12:25
41,CoronavirusUS,g16ckx,"My dad (54) got off the ventilator yesterday after being on it for 14 full days. He's a previous heart patient, diabetic, slightly overweight, but most importantly a fighter.",1523,2020-04-14 14:19:30
42,CoronavirusUS,g16edv,"WWE deemed 'essential business' in Florida, resumes live shows",33,2020-04-14 14:22:29
43,CoronavirusUK,g16hz2,How To Make Your Money Go Further During The Coronavirus Pandemic,5,2020-04-14 14:28:14
44,CoronavirusCA,g16j7h,Here’s how San Diego scientists are mounting a counterattack against the coronavirus.,31,2020-04-14 14:30:06
45,CoronavirusUS,g16k65,"Mass layoffs UNCOVERED. Piecing together the WARN notices from US labor offices, these employers come to surface:",12,2020-04-14 14:31:34
46,CoronavirusUK,g16kf6,Sanisburys local only allowing customers 3 at time,3,2020-04-14 14:31:58
47,CoronavirusUK,g16l0b,Stats 14/04,16,2020-04-14 14:32:55
48,CoronavirusUK,g16s21,What are you missing the most?,18,2020-04-14 14:43:56
49,CoronavirusUS,g16vjm,"Trump says New York governor ""seems to want Independence! That won't happen!""",40,2020-04-14 14:49:37
50,CoronavirusUK,g16z6a,Coronavirus: Old and obese 'at more risk' than cancer patients,5,2020-04-14 14:55:05
51,CoronavirusUK,g171cr,Govt early response to Covid19 looks remarkably similar to a strategy from 2014,5,2020-04-14 14:58:33
52,CoronavirusUS,g171od,"PriortyHealth waiving out-of-pocket costs for screening, testing and treatment of COVID-19",5,2020-04-14 14:59:02
53,CoronavirusUS,g172pf,8 in 10 Americans would wait to resume activities after government lifts coronavirus restrictions: poll,134,2020-04-14 15:00:30
54,CoronavirusNewYork,g1739g,"Doctors in the United States have been placing ventilated ARDS patients on their stomachs. Now they've doubled down on this with coronavirus patients, and it's paying off.",78,2020-04-14 15:01:16
55,CoronavirusNewYork,g174e2,[OC] 13 April 2020: Ranking Countries according to Total Tests Performed,1,2020-04-14 15:02:55
56,CoronavirusUS,g174wn,US Coronavirus Deaths are Tracking Slightly Higher than the EU but Show an Earlier Flattening of the Curve,22,2020-04-14 15:03:46
57,CoronavirusUS,g17a4i,Gov. Greg Abbott says reopening the Texas economy will be a slow process | HoustonPublicMedia.org,4,2020-04-14 15:11:26
58,CoronavirusNewYork,g17acd,Ulster County debuts 24/7 interactive platform for COVID-19 information,1,2020-04-14 15:11:46
59,CoronavirusUK,g17ewo,UK Government new Coronavirus (COVID-19) dashboard,8,2020-04-14 15:18:29
60,CoronavirusUS,g17f7m,I am not sure where to post this question but I hope I find the right place',22,2020-04-14 15:18:59
61,CoronavirusUS,g17ibg,Virginia pastor who defiantly held church service dies of coronavirus,148,2020-04-14 15:23:37
62,CoronavirusIllinois,g17ix7,A list of the most common Covid comorbidities causing death and what percentage of the US adult population has them.,0,2020-04-14 15:24:32
63,CoronavirusUS,g17mk5,"Coronavirus vaccine unlikely to be available within next 12 months, says WHO",6,2020-04-14 15:30:03
64,CoronavirusUS,g17p8t,A list of the most common comorbidities in Covid-related deaths and the percentage of the US adult population with each comorbity.,43,2020-04-14 15:34:09
65,CoronavirusIllinois,g17r0p,Community Transmission of SARS-CoV-2 at Two Family Gatherings ...,14,2020-04-14 15:36:58
66,CoronavirusIllinois,g17rks,"Poll Worker at Chicago Voting Site Dies of Coronavirus, Election Officials Say",86,2020-04-14 15:37:46
67,CoronavirusUS,g17ssw,"Hospital staff, or those close to hospital staff: What current State are you in, and what’s your current status in your hospital?Are you overburdened due to Covid- positive patients? Did you ever hit “the peak”?",15,2020-04-14 15:39:38
68,CoronavirusCA,g17ty5,With 4/20 coming up in six days a common sense request ...,11,2020-04-14 15:41:22
69,CoronavirusUK,g17u4k,"13th April - UK's daily death toll compared with Italy's, Spain's, France's and Germany's",299,2020-04-14 15:41:40
70,CoronavirusNewYork,g17wro,UAE and WHO send aid plane to Somalia to support it against coronavirus,2,2020-04-14 15:45:45
71,CoronavirusUK,g17xju,"Chart of UK hospital deaths to 13th April, log scaling",7,2020-04-14 15:46:57
72,CoronaVirusPA,g183jh,"+1146 new cases = 25,345 total cases in PA; +60 new deaths = 584 total deaths in PA",31,2020-04-14 15:55:46
73,CoronavirusUK,g184eo,Oasis and Warehouse 'to fall into administration',15,2020-04-14 15:57:04
74,CoronavirusNewYork,g18b5m,Cuomo update summary 4/14,16,2020-04-14 16:06:42
75,CoronavirusUK,g18br9,When will the money run out?,3,2020-04-14 16:07:37
76,CoronavirusUK,g18h5n,Any NHS Volunteers actually had 'alerts'?,5,2020-04-14 16:15:39
77,CoronavirusUK,g18jie,Am I entitled to 80% wage scheme?,0,2020-04-14 16:19:12
78,CoronavirusUK,g18o4c,Ground Zero: When the Cure is Worse than the Disease,4,2020-04-14 16:26:05
79,CoronavirusCA,g18std,"Coronavirus: San Francisco cancels 4/20 celebration, violators will be cited",76,2020-04-14 16:32:57
80,CoronavirusUS,g18tpy,"Coronavirus: San Francisco cancels 4/20 celebration, violators will be cited",13,2020-04-14 16:34:13
81,CoronavirusUS,g18wty,"I'm Ali Raja, MD and Shuhan He, MD emergency physicians from Mass General Hospital/Harvard Medical School. We're back again to talk from the front lines about COVID-19, social distancing, and #GetUsPPE.",5,2020-04-14 16:38:57
82,CoronavirusCA,g18xs2,[Mission Local] The Atlantic article about San Francisco is a fable. Here’s what’s really happening.,11,2020-04-14 16:40:20
83,CoronavirusNewYork,g18ygw,Song for New York - Empty Streets of New York City - COVID-19 - Help Support NYC - We are NY TOUGH!,1,2020-04-14 16:41:25
84,CoronavirusIllinois,g18zcc,"Coronavirus Video & Updates, 1,943,000 COVID-19 Cases",0,2020-04-14 16:42:46
85,CoronavirusUK,g19043,Is there any chance of my friend recovering?,7,2020-04-14 16:44:00
86,CoronavirusNewYork,g19049,"Coronavirus Video & Updates, 1,943,000 COVID-19 Cases",0,2020-04-14 16:44:01
87,CoronavirusUK,g194ze,How bad is the situation inside hospitals?,12,2020-04-14 16:51:20
88,CoronavirusUS,g19dhv,Code Rocky!,204,2020-04-14 17:03:51
89,CoronavirusUS,g19far,"23F, had plans to move from GA to WA that were unfortunately put on hold. When will it be likely that I can do this?",2,2020-04-14 17:06:21
90,CoronavirusUK,g19fov,Challenges made to lack of national framework for treatment prioritisation during COVID-19 pandemic | 39 Essex Chambers | Barristers' Chambers - NHS ENGLAND,2,2020-04-14 17:06:54
91,CoronavirusUS,g19h16,Higher rates of infection among people of color - Vitamin D levels,1,2020-04-14 17:08:45
92,CoronavirusUK,g19hrf,Can someone ELI5 why driving around to exercise or isolate in countryside far from home is so harmful?,15,2020-04-14 17:09:42
93,CoronavirusUK,g19ihe,There will be no Universal Basic Income. Good man Rishi you have my vote.,0,2020-04-14 17:10:40
94,CoronavirusUS,g19n8p,"In regards to the stimulus, what happens to people who havent filed taxes in the past few years but are on Social security. Trying to figure out if my dad needs to do anything or just wait?",11,2020-04-14 17:17:45
95,CoronaVirusPA,g19nnl,"Nightmares & Sleepness nights aside, is anyone else scared about all this talk of May?",20,2020-04-14 17:18:19
96,CoronavirusCA,g19oug,"1st known transmission cases of SARS-CoV-2 in a US healthcare facility (Solano County, CA)",15,2020-04-14 17:20:07
97,CoronavirusNewYork,g19whb,King Trump thinks he can scare us into submission — but New York has had the power all along | The Independent,1,2020-04-14 17:31:26
98,CoronavirusNewYork,g19wks,"Cuomo Threatens ‘Constitutional Challenge’ If Trump Orders States To Reopen Too Early. The New York governor said any such order would be “dictatorial,” a day after the president falsely claimed to have “total” authority over states.",19,2020-04-14 17:31:33
99,CoronavirusUK,g19wwl,To those of you that do not follow the one way system in supermarkets. Why?,2,2020-04-14 17:32:00
100,CoronavirusUS,g1a1ym,into 2022,0,2020-04-14 17:39:32
101,CoronavirusNewYork,g1a25t,During a National Emergency how can a Pact of Governors form without any citizens’ vote? Who chooses when and how you are released back into society? Serious question.,0,2020-04-14 17:39:51
102,CoronavirusUK,g1a27g,Daily figures filtered by city or region?,2,2020-04-14 17:39:56
103,CoronavirusCA,g19oug,"1st known transmission cases of SARS-CoV-2 in a US healthcare facility (Solano County, CA)",16,2020-04-14 17:20:07
104,CoronavirusNewYork,g19whb,King Trump thinks he can scare us into submission — but New York has had the power all along | The Independent,1,2020-04-14 17:31:26
105,CoronavirusNewYork,g19wks,"Cuomo Threatens ‘Constitutional Challenge’ If Trump Orders States To Reopen Too Early. The New York governor said any such order would be “dictatorial,” a day after the president falsely claimed to have “total” authority over states.",17,2020-04-14 17:31:33
106,CoronavirusNewYork,g1a25t,During a National Emergency how can a Pact of Governors form without any citizens’ vote? Who chooses when and how you are released back into society? Serious question.,0,2020-04-14 17:39:51
107,CoronavirusUK,g1a27g,Daily figures filtered by city or region?,2,2020-04-14 17:39:56
108,CoronavirusUS,g1a431,"Canada, U.S. in talks to extend border closures amid pandemic, sources say",6,2020-04-14 17:42:38
109,CoronavirusUS,g1a8zd,"Coronavirus cases in New York top 200,000 as the outbreak appears to slow",11,2020-04-14 17:50:07
110,CoronavirusNewYork,g1ah82,Gov. Cuomo: ‘I Believe the Worst Is Over if We Continue To Be Smart’,9,2020-04-14 18:02:05
111,CoronavirusUS,g1alz4,Ivermectin used to successfully treat dozens of patients in Florida,8,2020-04-14 18:09:15
112,CoronavirusUS,g1ams9,[OC] COVID19 cases drop out of exponential growth in almost every US state,38,2020-04-14 18:10:27
113,CoronavirusUK,g1ap1a,UK coronavirus rules relaxed for people with autism and learning disabilities | World news,3,2020-04-14 18:13:56
114,CoronavirusUK,g1aplf,I'm terrified the cars driving by me with their windows down when I exercise are putting me at risk.,0,2020-04-14 18:14:49
115,CoronavirusUS,g1ar5c,"Most Americans are following social distancing guidelines. Original estimates for compliance were put at around 50%, but in the end, “compliance to the message has been in excess of 90%”",369,2020-04-14 18:17:15
116,CoronavirusNewYork,g1atrz,How do the grocery stores look this week?,6,2020-04-14 18:21:02
117,CoronavirusIllinois,g1auzo,Is it safe to see a physician during these times?,0,2020-04-14 18:22:54
118,CoronavirusCA,g1b31m,Low-Income Angelenos Can Apply for Pre-Paid Debit Cards Starting Today,35,2020-04-14 18:34:58
119,CoronavirusUK,g1b7pd,Instead of clapping for essential workers we should clap for the people in quarantine this thursday.,1,2020-04-14 18:41:55
120,CoronavirusUS,g1b9t5,CNBC: Waiting on your stimulus check? There are ways to help speed it up,4,2020-04-14 18:45:04
121,CoronavirusUK,g1bar8,Coronavirus lockdown sparks surge in fly-tipping across UK | ITV News,5,2020-04-14 18:46:29
122,CoronavirusUS,g1bb7h,"I cannot find disinfectant spray etc. anywhere, can I use 95% alcohol vodka?",11,2020-04-14 18:47:09
123,CoronavirusUK,g1bbqp,Asymptomatic cases or mild ones that go unnoticed seem very optimistic?,0,2020-04-14 18:47:52
124,CoronavirusUK,g1bcu5,"My flatmate is still bringing ""outsiders"" round, where do I stand?",1,2020-04-14 18:49:37
125,CoronavirusCA,g1bfoa,"Megathread: Gavin Newsom to discuss California's ""incremental release of the stay-at-home orders""",219,2020-04-14 18:53:49
126,CoronavirusNewYork,g1bg6d,"Important coronavirus update, what New York governor Andrew Cuomo said to Trump today, see coronavirus data update for New York",0,2020-04-14 18:54:30
127,CoronavirusUS,g1bhac,"Coronavirus Update: NYC to begin manufacturing 50,000 COVID-19 test kits per week",21,2020-04-14 18:56:11
128,CoronavirusUS,g1bms5,'It is the worst pain': Comedian Michael Yo discusses his battle with coronavirus,9,2020-04-14 19:04:15
129,CoronavirusUS,g1bp2s,Stay healthy northern neighbors.,6,2020-04-14 19:07:31
130,CoronavirusCA,g1bs15,"The East Coast, Always in the Spotlight, Owes a Debt to the West",44,2020-04-14 19:11:46
131,CoronavirusUS,g1bu93,CNBC: What to do if you can’t pay your credit card bills,2,2020-04-14 19:14:58
132,CoronavirusUS,g1bw7g,Colorado Public Radio searching for folks to discuss grief,6,2020-04-14 19:17:41
133,CoronavirusUS,g1byym,C19 Weekly: Youtube series by Columbia University professor reviewing C19 research papers,3,2020-04-14 19:21:46
134,CoronavirusUS,g1bz1v,The bright side of Covid-19,5,2020-04-14 19:21:54
135,CoronavirusUS,g1c0bw,Interim Recommendations for U.S. Households with Suspected or Confirmed Coronavirus Disease 2019 (COVID-19).,7,2020-04-14 19:23:36
136,CoronavirusUK,g1c2pw,Workers & the Covid-19 Crisis - How do we fight for our rights? A workers forum to fight back,1,2020-04-14 19:27:04
137,CoronavirusUS,g1c3pg,First Arizona COVID-19 patient treated with ECMO therapy survives,17,2020-04-14 19:28:24
138,CoronavirusNewYork,g1c4sh,Trump Accuses Governors of ‘Mutiny’ in Coronavirus Power Struggle,12,2020-04-14 19:29:59
139,CoronavirusNewYork,g1c7cj,Cuomo update summary 4/14,4,2020-04-14 19:33:38
140,CoronavirusCA,g1c97d,Please share ❤️❤️ any help is greatly appreciated,88,2020-04-14 19:36:18
141,CoronavirusUK,g1983h,Government has misled public over UK deaths being lower than France,1,2020-04-14 16:56:04
142,CoronavirusUS,g1cax0,"‪The IRS will soon be setting up an online page where you can register for direct deposit, if you haven’t done so yet, so you can receive your stimulus check sooner.‬ ‪PLEASE EDUCATE AND HELP YOUR NON-TECH FRIENDS/FAMILY SO THEY DON’T GET SCAMMED!‬",129,2020-04-14 19:38:50
143,CoronavirusUS,g1cb4e,"""It's a Complete Abomination""...Hedge Funds Applying for Bailouts",110,2020-04-14 19:39:08
144,CoronavirusIllinois,g1cbqa,"Public Health Officials Announce 1,222 New Cases of Coronavirus Disease",38,2020-04-14 19:40:00
145,CoronavirusUK,g164gf,New UK deaths announced April 14th,3,2020-04-14 14:06:05
146,CoronavirusUK,g17y8d,Birmingham NHS Nightingale Hospital phone mast hit by fire amid 5G coronavirus conspiracy claims,16,2020-04-14 15:47:56
147,CoronavirusUS,g1cg34,California governor outlines plan to reopen in conjunction with West Coast states,6,2020-04-14 19:46:21
148,CoronavirusUS,g1cjlf,The majority of people hospitalized in the U.S. with COVID19 are under the age of 65.,15,2020-04-14 19:51:25
149,CoronavirusUS,g1cpjv,Rahm Emanuel reprises 'never let a crisis go to waste' catchphrase amid coronavirus pandemic,4,2020-04-14 20:00:12
150,CoronavirusIllinois,g1csth,Today's Illinois Public Health Numbers Compared to the Current and Previous UW Model Numbers,31,2020-04-14 20:05:06
151,CoronavirusUK,g1cvqo,Lockdown to end? UK curfew could be lifted by May 18 as new infections decline – expert,2,2020-04-14 20:09:18
152,CoronavirusNewYork,g1cz6w,Taiwan crowdfunds to post message to New York,152,2020-04-14 20:14:27
153,CoronavirusUS,g1czlp,How has your employer treated you after you were tested for Covid-19?,4,2020-04-14 20:15:08
154,CoronavirusUS,g1d9vq,"The East Coast, Always in the Spotlight, Owes a Debt to the West",0,2020-04-14 20:31:15
155,CoronavirusUS,g1daoq,"CMV: We can effectively achieve herd immunity to SARS-CoV-2 in less than half a year, and without catastrophic death tolls, even if we never find a vaccine.",0,2020-04-14 20:32:37
156,CoronavirusUS,g1dcrq,The Washington Post Goes Rogue: China Lab In Focus Of Coronavirus Outbreak,43,2020-04-14 20:36:29
157,CoronavirusUS,g1dfxp,Help me understand these PPP loans,1,2020-04-14 20:41:47
158,CoronavirusUK,g1dgw5,Freeman asks Hancock to look into PPE supplier 'misunderstanding',1,2020-04-14 20:43:14
159,CoronavirusUS,g1dltn,J&J can produce up to 900 million coronavirus vaccine doses by April 2021 if trials go well,17,2020-04-14 20:51:14
160,CoronavirusNewYork,g1dlwf,"NYC Health Dept. confirms 10,367 have died of coronavirus in five boroughs",10,2020-04-14 20:51:20
161,CoronavirusUK,g1dmr5,Question about Exiting Lockdown and Kids,2,2020-04-14 20:52:41
162,CoronavirusNewYork,g1dn7y,King Trump thinks he can scare us into submission — but New York has had the power all along,0,2020-04-14 20:53:25
163,CoronavirusUK,g1dsbz,Boss asking me to come to work. I'm furloughed.,19,2020-04-14 21:01:08
164,CoronavirusNewYork,g1e03k,"BREAKING: New York City links 3,778 additional deaths to coronavirus under new criteria, raising city's total to 11,683",34,2020-04-14 21:12:40
165,CoronavirusUS,g1e19n,4/14 White House Press Briefing - Coronavirus Task Force,6,2020-04-14 21:14:30
166,CoronavirusUK,g1e36l,Am I a vulnerable person?,2,2020-04-14 21:17:32
167,CoronavirusUS,g1e937,Thoughtful perspective on what to expect of our Pandemic Summer...,3,2020-04-14 21:26:36
168,CoronavirusUS,g1e9nn,California Governor outlines plan to lift stay-at-home order,11,2020-04-14 21:27:26
169,CoronavirusNewYork,g1ea0v,the rich live while the poor suffer. capitalist culture is worsening the virus.,18,2020-04-14 21:28:02
170,CoronavirusUK,g1ejpe,What would you say to someone who was thinking of ending it during this lockdown?,2,2020-04-14 21:42:45
171,CoronavirusUK,g1ek2z,Being away from your partner,27,2020-04-14 21:43:21
172,CoronavirusUK,g1elae,"The Covid Report 14-04-20: Counting The Dead. Afua Hirsh interviews Dr Anthony Costello, Dr Allyson Pollock, Dr Bharat Pankhania, Dr Rosalyn Moran",0,2020-04-14 21:45:18
173,CoronavirusNewYork,g1eqjh,「Inside a Real Chinese Wet Market // (含中文字幕) //一个真实的中国“湿货”市场」,0,2020-04-14 21:53:22
174,CoronavirusUS,g1es47,Universities begin considering canceling in-person classes until 2021,21,2020-04-14 21:55:46
175,CoronavirusUK,g1eslj,The Covid Report. 14/04. Independent expert discussion. What are we not being told?,6,2020-04-14 21:56:30
176,CoronavirusUS,g1et0u,(CA) California Gov. Gavin Newsom unveils guide to lifting state’s coronavirus restrictions,18,2020-04-14 21:57:07
177,CoronavirusUS,g1ex2c,"Immunity from COVID-19 antibodies not certain, HIV co-discoverer cautions",8,2020-04-14 22:03:10
178,CoronavirusUS,g1f0wl,Harvard Study: Projecting the transmission dynamics of SARS-CoV-2 through the postpandemic period,3,2020-04-14 22:09:00
179,CoronavirusNewYork,g1f4gy,Where is the claim benefits option? I finally received a call last Sunday the lady told me I can go to my account every Sunday and claim my weekly payment but I’m checking my account now and that option still isn’t showing..,4,2020-04-14 22:14:22
180,CoronavirusUK,g1f5cb,The Trump Show is starting,1,2020-04-14 22:15:45
181,CoronavirusUK,g1f7qo,"#THROWBACK TUESDAY: Prof Chris Whitty talks about how to control a pandemic, in 2018",8,2020-04-14 22:19:24
182,CoronavirusUK,g1f8g4,Maybe a stupid question,2,2020-04-14 22:20:32
183,CoronavirusUS,g1f9b0,"Nursing homes. Huge industry (mostly privately owned and equity packaged) with political pull and campaign contributions. Coronaries numbers largely unreported, not reported at all, names of nursing homes hidden by gov't. mandate in some states.",14,2020-04-14 22:21:50
184,CoronavirusIllinois,g1fbc3,Pritzker in Talks With Midwest Governors to Coordinate on Plan to Reopen,89,2020-04-14 22:25:03
185,CoronavirusUS,g1fbc2,'A Complete Abomination': Mega-Rich Hedge Funds Swoop Down to Grab Covid-19 Small Business Relief Funds,15,2020-04-14 22:25:03
186,CoronavirusCA,g1fbhq,"San Francisco Pride parade, celebration canceled due to coronavirus crisis",26,2020-04-14 22:25:16
187,CoronavirusUS,g1fcdt,Tax Relief Eligibility Question,1,2020-04-14 22:26:37
188,CoronavirusUS,g1fcsw,Trump announces U.S. will halt funding for WHO over coronavirus response,64,2020-04-14 22:27:17
189,CoronavirusNewYork,g1fe28,Our Pandemic Summer: The fight against the coronavirus won’t be over when the U.S. reopens. Here’s how the nation must prepare itself.,2,2020-04-14 22:29:13
190,CoronavirusUK,g1ffh4,How long is an asymptomatic person contagious for?,3,2020-04-14 22:31:30
191,CoronavirusUS,g1fgjs,Medical experts say Oklahoma’s 100-plus death toll from COVID-19 could be higher than the official tally if the state isn’t conducting autopsies on people found dead in their homes.,12,2020-04-14 22:33:14
192,CoronavirusUK,g1fgum,Greatest understatement in history,1,2020-04-14 22:33:37
193,CoronavirusUK,g1fgv7,Trump halts World Health Organization funding over handling of coronavirus outbreak,8,2020-04-14 22:33:38
194,CoronavirusUS,g1fh9d,Trump halts funding to WHO for their mistakes.,2,2020-04-14 22:34:15
195,CoronavirusUK,g1fhz6,Have they succeeded in delaying the peak?,5,2020-04-14 22:35:25
196,CoronavirusUS,g1fi49,"As Trump Asserts His Authority, Baker And Other Govs. Commit To Work Together To Reopen State",4,2020-04-14 22:35:36
