,subreddit,Pid,title,upvote,date
216,CoronavirusUK,fzi600,Coronavirus lockdown restrictions will last until vaccine is developed,3,2020-04-11 20:27:07
217,CoronavirusUS,fzi726,USA Death count is at second Hughes till now which is very alarming,1,2020-04-11 20:27:51
218,CoronavirusUS,fzi7y3,Interesting read about how the virus mutated around the world,1,2020-04-11 20:28:31
219,CoronavirusUS,fzi89m,Thousands of Florida residents claim unemployment benefits as state governor says schools must reopen despite increasing COVID-19 infections,2,2020-04-11 20:28:46
220,CoronavirusUS,fzi9c2,Taiwan figured out a way .,4,2020-04-11 20:29:33
221,CoronavirusUS,fzibde,I’m pretty sure I had coronavirus back in February,1,2020-04-11 20:31:01
222,CoronavirusUS,fzic6u,"""It has been barely a few weeks since the coronavirus was declared a pandemic. The pace at which the SARS-CoV-2 virus has spread across the globe is jolting, but equally impressive is the speed at which scientists and clinicians have been fighting back.""",2,2020-04-11 20:31:36
223,CoronavirusUK,fzhrhk,"I'm 99% certain I had Covid-19 but of course was never tested as I was a 'mild' case, but comparing my symptoms to confirmed cases I can be pretty sure I've had the coronavirus. I made this as I thought it might help others who have symptoms, although your experience may differ.",20,2020-04-11 20:16:28
224,CoronavirusUK,fza9yf,When someone asks me how working from home is going,19,2020-04-11 17:18:25
225,CoronavirusUK,fz8rva,NHS England stopped publish data on critical care capacity at beginning of COVID-19 crisis,1,2020-04-11 16:26:25
226,CoronavirusUK,fz8gc4,"150,000 Brits will die during coronavirus pandemic through domestic violence and suicides",0,2020-04-11 16:11:27
227,CoronavirusUS,fzir0y,Coronavirus latest: at a glance | World news | The Guardian|US deaths overtake Italy,1,2020-04-11 20:42:39
228,CoronavirusUK,fz74oc,28 days of isolation later,5,2020-04-11 15:07:41
229,CoronavirusCA,fzitly,New signs suggest coronavirus was in California far earlier than anyone knew,0,2020-04-11 20:45:52
230,CoronavirusUS,fzitrf,"A pharmacotherapy specialist discusses ""Coronavirus research done too fast is testing publishing safeguards, bad science is getting through."" Very intriguing article about the effects of panic, media, and urgency on sound research and development.",1,2020-04-11 20:46:09
231,CoronavirusUS,fziu1q,COVID-19 live data overview,2,2020-04-11 20:46:40
232,CoronavirusUS,fziy5b,"I just filed my 2019 taxes and they have yet to be ""approved"" by the irs the bank account has changed since last year. Does that mean stimulus will come by check?",2,2020-04-11 20:53:33
233,CoronavirusUS,fziyxd,I feel like such a sucker for continuing to work my full time job while everyone else is on unemployment,0,2020-04-11 20:54:50
234,CoronavirusUS,fzj5ld,"If you had and recovered from the virus, what would you do?",5,2020-04-11 21:05:58
235,CoronavirusUK,fzj65w,Legend 💙,55,2020-04-11 21:06:55
236,CoronavirusUS,fzj717,Great art from MJ Hiblen,17,2020-04-11 21:08:22
237,CoronavirusUK,fzj8qh,"Saw a new challenge trying to start on twitter, trying to encourage people to stay at home during COVID19",0,2020-04-11 21:11:10
238,CoronavirusUS,fzj9gl,[Florida] Neighbors Partying,10,2020-04-11 21:12:28
239,CoronavirusUK,fzjc1h,Let's talk about 3D printers,0,2020-04-11 21:16:58
240,CoronavirusUS,fzjdkg,"With Postal Service on 'Verge of Collapse' and 630,000 Jobs at Risk, Trump Slammed for Refusing to Act",5,2020-04-11 21:19:30
241,CoronavirusUS,fz7k5w,"Watch Now : Trump: ""We have to get our country open."" Question: ""Will you say, sir, what metrics you will use to make that decision?"" Trump: ""The metric's right here."" [Points to head]",100,2020-04-11 15:29:42
242,CoronavirusUS,fz7lpe,Walmart CEO says we're in the 'hair color' phase of panic buying,54,2020-04-11 15:31:54
243,CoronavirusNewYork,fz7n06,Has anyone received any calls yet?,5,2020-04-11 15:33:34
244,CoronavirusNewYork,fz7qan,Coronavirus in New York: Latest Updates,5,2020-04-11 15:38:03
245,CoronavirusUK,fz7sc1,Force removal of Early Termination Clauses?,1,2020-04-11 15:40:40
246,CoronavirusUS,fz7uo6,"A plan to defeat coronavirus finally emerges, but it’s not from the White House",0,2020-04-11 15:43:39
247,CoronavirusUS,fz7wib,Help Relaying the Message,0,2020-04-11 15:46:03
248,CoronavirusUS,fz7yek,When does this end? Open up colleges?,0,2020-04-11 15:48:25
249,CoronavirusUK,fz7ysz,Facing a huge moral dilemma and need help,15,2020-04-11 15:48:56
250,CoronavirusUS,fz85ik,Indiana government count of COVID-19 deaths versus John Hopkins dataset,9,2020-04-11 15:57:46
251,CoronavirusUS,fz88ds,Belgian study on safe distancing while exercising,3,2020-04-11 16:01:27
252,CoronavirusUS,fz8c5f,How can the Coronavirus pandemic end?,0,2020-04-11 16:06:08
253,CoronavirusNewYork,fz8che,[OC] 11 April 2020 | Top Countries according to deaths per million people,2,2020-04-11 16:06:34
254,CoronavirusUS,fz8dho,South Korea says recovereed patients re-testing positive,27,2020-04-11 16:07:54
255,CoronavirusUS,fz8fov,Stimulus package,908,2020-04-11 16:10:38
256,CoronavirusNewYork,fz8h9h,Coronavirus: NYC public schools will remain closed for rest of year,3,2020-04-11 16:12:35
257,CoronavirusCA,fz8jpa,"Marin County is reporting 6% mortality rate on 153 positive cases. They’ve only tested 2047 people 258,826 of the counties residents. Additionally the county announced on March 23rd their Public Health Officer, Matt Willis, tested positive for community acquired COVID.",159,2020-04-11 16:15:49
258,CoronavirusUK,fz8mki,Coronavirus mutated into three distinct strains as it spread across the world | Metro News,1,2020-04-11 16:19:35
