,subreddit,Pid,title,upvote,date
197,CoronavirusUS,g1fkuj,Dairy farmers forced to dump milk as demand drops amid coronavirus closures,6,2020-04-14 22:39:45
198,CoronavirusCA,g1fmt6,Newsom's prerequistes to reopen California,30,2020-04-14 22:42:46
199,CoronavirusNewYork,g1foic,"April 13, 2020: New York reported 195,031 confirmed cases of Coronavirus (COVID-19). New York City has the majority of cases with 106,763 reported. Out of the boroughs, Queens has the majority of cases with 33,985. Brooklyn comes second with 28,404 and Bronx with 22,205 is third.",3,2020-04-14 22:45:36
200,CoronavirusUS,g1fojo,Trump halts World Health Organization funding over handling of coronavirus outbreak,4,2020-04-14 22:45:40
201,CoronavirusUK,g1fpcm,This cant be right,0,2020-04-14 22:46:59
202,CoronavirusNewYork,g1fqdv,About how long does it take to get a test in Suffolk county?,1,2020-04-14 22:48:39
203,CoronavirusUS,g1ftmw,Has it been officially confirmed that Covid-19 can actually be spread through talking and breathing as well as coughing and sneezing?,9,2020-04-14 22:53:55
204,CoronavirusCA,g1ftwx,Day one of CA state unemployment payments that included an extra $600 a week to cover job losses spawned by the Coronavirus was accompanied by a head-spinning price tag: $336 million in payouts,42,2020-04-14 22:54:23
205,CoronavirusUS,g1fvd8,"Tracking the US COVID-19 pandemic with interactive graphs & maps that show insightful statistics (Cases, deaths & more)",1,2020-04-14 22:56:41
206,CoronavirusUS,g1fvs2,Can an employer force you to quit a second job because of coronavirus exposure concerns?,4,2020-04-14 22:57:22
207,CoronavirusUK,g1fxpi,Publish exit strategy this week - Labour,5,2020-04-14 23:00:22
208,CoronavirusUS,g1fzjm,Antivaxers,243,2020-04-14 23:03:13
209,CoronavirusUS,g1fzmc,"My mother, 56, tested positive for coronavirus while staying at a nursing home in Northern Virginia. Her case alone made news headlines",20,2020-04-14 23:03:20
210,CoronavirusUK,g1fzzt,#YouClapForMeNow and #WeWillRemember - A thank you video to all key workers who literally are sacrificing their lives to help us stay safe.,0,2020-04-14 23:03:54
211,CoronavirusNewYork,g1g3yl,"Tracking New York's COVID-19 pandemic with interactive graphs & maps that let you view cases, deaths & recoveries in your area, as well as viral exponential growth",1,2020-04-14 23:10:11
212,CoronavirusNewYork,g1g5h2,I am doing an essay for school and would love to hear some real experiences,0,2020-04-14 23:12:33
213,CoronavirusUS,g1g7hw,How long does the virus live on food surfaces?,6,2020-04-14 23:16:02
214,CoronavirusUS,g1g7zh,"How, exactly, are C19 tests made?",3,2020-04-14 23:16:53
215,CoronavirusUS,g1g8rl,Trump Halts U.S. Funding of World Health Organization.,21,2020-04-14 23:18:11
216,CoronavirusNewYork,g1e03k,"BREAKING: New York City links 3,778 additional deaths to coronavirus under new criteria, raising city's total to 11,683",33,2020-04-14 21:12:40
217,CoronavirusUS,g1e19n,4/14 White House Press Briefing - Coronavirus Task Force,4,2020-04-14 21:14:30
218,CoronavirusUK,g1e36l,Am I a vulnerable person?,2,2020-04-14 21:17:32
219,CoronavirusUS,g1e937,Thoughtful perspective on what to expect of our Pandemic Summer...,4,2020-04-14 21:26:36
220,CoronavirusUS,g1e9nn,California Governor outlines plan to lift stay-at-home order,12,2020-04-14 21:27:26
221,CoronavirusNewYork,g1ea0v,the rich live while the poor suffer. capitalist culture is worsening the virus.,18,2020-04-14 21:28:02
222,CoronavirusUK,g1ejpe,What would you say to someone who was thinking of ending it during this lockdown?,2,2020-04-14 21:42:45
223,CoronavirusUK,g1ek2z,Being away from your partner,27,2020-04-14 21:43:21
224,CoronavirusUK,g1elae,"The Covid Report 14-04-20: Counting The Dead. Afua Hirsh interviews Dr Anthony Costello, Dr Allyson Pollock, Dr Bharat Pankhania, Dr Rosalyn Moran",0,2020-04-14 21:45:18
225,CoronavirusNewYork,g1eqjh,「Inside a Real Chinese Wet Market // (含中文字幕) //一个真实的中国“湿货”市场」,0,2020-04-14 21:53:22
226,CoronavirusUS,g1es47,Universities begin considering canceling in-person classes until 2021,21,2020-04-14 21:55:46
227,CoronavirusUK,g1eslj,The Covid Report. 14/04. Independent expert discussion. What are we not being told?,7,2020-04-14 21:56:30
228,CoronavirusUS,g1et0u,(CA) California Gov. Gavin Newsom unveils guide to lifting state’s coronavirus restrictions,18,2020-04-14 21:57:07
229,CoronavirusNewYork,g1f4gy,Where is the claim benefits option? I finally received a call last Sunday the lady told me I can go to my account every Sunday and claim my weekly payment but I’m checking my account now and that option still isn’t showing..,4,2020-04-14 22:14:22
230,CoronavirusUK,g1f5cb,The Trump Show is starting,1,2020-04-14 22:15:45
231,CoronavirusUK,g1f7qo,"#THROWBACK TUESDAY: Prof Chris Whitty talks about how to control a pandemic, in 2018",8,2020-04-14 22:19:24
232,CoronavirusUK,g1f8g4,Maybe a stupid question,2,2020-04-14 22:20:32
233,CoronavirusUS,g1f9b0,"Nursing homes. Huge industry (mostly privately owned and equity packaged) with political pull and campaign contributions. Coronaries numbers largely unreported, not reported at all, names of nursing homes hidden by gov't. mandate in some states.",14,2020-04-14 22:21:50
234,CoronavirusIllinois,g1fbc3,Pritzker in Talks With Midwest Governors to Coordinate on Plan to Reopen,89,2020-04-14 22:25:03
235,CoronavirusCA,g1fbhq,"San Francisco Pride parade, celebration canceled due to coronavirus crisis",28,2020-04-14 22:25:16
236,CoronavirusUS,g1fcsw,Trump announces U.S. will halt funding for WHO over coronavirus response,69,2020-04-14 22:27:17
237,CoronavirusNewYork,g1fe28,Our Pandemic Summer: The fight against the coronavirus won’t be over when the U.S. reopens. Here’s how the nation must prepare itself.,3,2020-04-14 22:29:13
238,CoronavirusUK,g1ffh4,How long is an asymptomatic person contagious for?,3,2020-04-14 22:31:30
239,CoronavirusUS,g1fgjs,Medical experts say Oklahoma’s 100-plus death toll from COVID-19 could be higher than the official tally if the state isn’t conducting autopsies on people found dead in their homes.,11,2020-04-14 22:33:14
240,CoronavirusUK,g1fgum,Greatest understatement in history,0,2020-04-14 22:33:37
241,CoronavirusUK,g1fgv7,Trump halts World Health Organization funding over handling of coronavirus outbreak,6,2020-04-14 22:33:38
242,CoronavirusUK,g1fhz6,Have they succeeded in delaying the peak?,4,2020-04-14 22:35:25
243,CoronavirusUS,g1fi49,"As Trump Asserts His Authority, Baker And Other Govs. Commit To Work Together To Reopen State",3,2020-04-14 22:35:36
244,CoronavirusUS,g1fkuj,Dairy farmers forced to dump milk as demand drops amid coronavirus closures,6,2020-04-14 22:39:45
245,CoronavirusCA,g1fmt6,Newsom's prerequistes to reopen California,29,2020-04-14 22:42:46
246,CoronavirusNewYork,g1foic,"April 13, 2020: New York reported 195,031 confirmed cases of Coronavirus (COVID-19). New York City has the majority of cases with 106,763 reported. Out of the boroughs, Queens has the majority of cases with 33,985. Brooklyn comes second with 28,404 and Bronx with 22,205 is third.",3,2020-04-14 22:45:36
247,CoronavirusUK,g1fpcm,This cant be right,0,2020-04-14 22:46:59
248,CoronavirusNewYork,g1fqdv,About how long does it take to get a test in Suffolk county?,1,2020-04-14 22:48:39
249,CoronavirusUS,g1ftmw,Has it been officially confirmed that Covid-19 can actually be spread through talking and breathing as well as coughing and sneezing?,7,2020-04-14 22:53:55
250,CoronavirusCA,g1ftwx,Day one of CA state unemployment payments that included an extra $600 a week to cover job losses spawned by the Coronavirus was accompanied by a head-spinning price tag: $336 million in payouts,44,2020-04-14 22:54:23
251,CoronavirusUS,g1fvs2,Can an employer force you to quit a second job because of coronavirus exposure concerns?,5,2020-04-14 22:57:22
252,CoronavirusUK,g1fxpi,Publish exit strategy this week - Labour,5,2020-04-14 23:00:22
253,CoronavirusUS,g1fzjm,Antivaxers,248,2020-04-14 23:03:13
254,CoronavirusUS,g1fzmc,"My mother, 56, tested positive for coronavirus while staying at a nursing home in Northern Virginia. Her case alone made news headlines",18,2020-04-14 23:03:20
255,CoronavirusUK,g1fzzt,#YouClapForMeNow and #WeWillRemember - A thank you video to all key workers who literally are sacrificing their lives to help us stay safe.,0,2020-04-14 23:03:54
256,CoronavirusNewYork,g1g3yl,"Tracking New York's COVID-19 pandemic with interactive graphs & maps that let you view cases, deaths & recoveries in your area, as well as viral exponential growth",1,2020-04-14 23:10:11
257,CoronavirusNewYork,g1g5h2,I am doing an essay for school and would love to hear some real experiences,0,2020-04-14 23:12:33
258,CoronavirusUS,g1g7hw,How long does the virus live on food surfaces?,6,2020-04-14 23:16:02
259,CoronavirusUS,g1g7zh,"How, exactly, are C19 tests made?",4,2020-04-14 23:16:53
260,CoronavirusUS,g1g8rl,Trump Halts U.S. Funding of World Health Organization.,21,2020-04-14 23:18:11
261,CoronavirusUS,g1ger8,"NYC death toll jumps by 3,700 after uncounted fatalities are added",40,2020-04-14 23:28:01
262,CoronavirusIllinois,g1gmmp,"2 out of 5 National COVID-19 Hot Spots are in Illinois (Cook County Jail, Stateville Prison)",45,2020-04-14 23:41:05
263,CoronavirusUK,g1gqjc,I'm boasting about my brother but its relevant I feel. He has been working on a.graphic design social distancing project ❤,6,2020-04-14 23:47:28
264,CoronavirusUS,g1gvh3,"US may have to endure social distancing until 2022 if no vaccine is quickly found, scientists predict",9,2020-04-14 23:55:28
265,CoronavirusUS,g1gy50,(CA) Anyone else not receiving their California unemployment benefits from the Covid crisis?,6,2020-04-15 00:00:07
266,CoronavirusUS,g1gyeb,A friend asked me if I wanted to hang out today.,28,2020-04-15 00:00:32
267,CoronaVirusPA,g1h0xv,So is it possible to lease a house in this state right now?,4,2020-04-15 00:04:55
268,CoronavirusUS,g1h4pw,WWE airs live after being deemed essential service in Florida,6,2020-04-15 00:11:11
269,CoronavirusUS,g1h52e,Harvard study and distanciation,3,2020-04-15 00:11:47
270,CoronavirusUS,g1h5tp,New York City records sharp jump in coronavirus deaths as presumed cases added,7,2020-04-15 00:13:10
271,CoronavirusUS,g1h7jt,"City of Savannah, GA to begin hazard pay, distributing meals to homeless camps",9,2020-04-15 00:16:12
272,CoronavirusUS,g1ha6b,What will happen to the retail stores?,15,2020-04-15 00:20:34
273,CoronavirusUS,g1hcpq,CIA: Please Ignore Trump’s Medical Advice On Coronavirus,21,2020-04-15 00:24:32
274,CoronavirusCA,g1hdin,How long has it been here?,10,2020-04-15 00:25:50
275,CoronavirusUS,g1helr,‘You don’t become king because there’s a national emergency’: Governor hits back at Trump’s claim his ‘authority is total’,11,2020-04-15 00:27:39
276,CoronavirusUS,g1hevv,Minimum-Wage Workers Are Dying to Keep Everyone Else Alive. They Deserve More.,155,2020-04-15 00:28:08
277,CoronavirusUS,g1hgz1,How is distribution of the stimulus checks timed?,7,2020-04-15 00:31:36
278,CoronaVirusPA,g1hhfu,PA House approves bill to reopen businesses. Link below.,29,2020-04-15 00:32:25
279,CoronavirusUS,g1hi3g,Covid19 vaccine,3,2020-04-15 00:33:32
280,CoronavirusCA,g1hkjm,Help me understand what Newsom said about staggering the school day next year,12,2020-04-15 00:37:45
281,CoronavirusUS,g1hpwb,Farmers are throwing out food that could go to food banks. American Farm Bureau and Feeding America want to change that,69,2020-04-15 00:46:33
282,CoronavirusUS,g1hs8l,Let’s play a game of “reopen the country”,14,2020-04-15 00:50:47
283,CoronavirusUS,g1hu8k,"California must do 6 things before coronavirus restrictions can be lifted, Gov. Newsom says",7,2020-04-15 00:54:23
284,CoronavirusUK,g1i0fb,"Daily Discussion Megathread - April 15 | Questions, images, videos, comments, unconfirmed reports, theories, suggestions",2,2020-04-15 01:05:26
285,CoronavirusUK,g1i7ef,"Australia's medical chief says UK's response to coronavirus has caused ""carnage""",5,2020-04-15 01:18:17
286,CoronavirusNewYork,g1i9wq,What kinds of things will offices need to do to reopen?,4,2020-04-15 01:22:45
287,CoronavirusUS,g1ibaa,Unemployment wannabe,7,2020-04-15 01:25:16
288,CoronavirusUS,g1ifx4,US marks record for most coronavirus deaths reported in a single day,2,2020-04-15 01:33:25
289,CoronavirusUS,g1ijz4,Best live data feed for COVID19 Stats?,2,2020-04-15 01:40:35
290,CoronavirusUK,g1ipsi,France starts to embrace #Masks4All,4,2020-04-15 01:51:20
291,CoronavirusUS,g1ir5e,"⚠️USA reported a record 2,407 #Covid_19 deaths and 26,945 cases today. Totaling to 613,886 cases & 26,047 deaths. Cases by state in link",21,2020-04-15 01:53:49
292,CoronavirusUK,g1ixo1,Daily Rant & Vent Megathread - April 15,1,2020-04-15 02:05:36
293,CoronavirusUS,g1ixr6,"Walmart gives at-risk shoppers special access to online grocery pickup: Walmart stores will reserve a one-hour time slot for grocery pickup daily for first responders, people with disabilities, and anyone at high risk of contracting severe illness from COVID-19.",4,2020-04-15 02:05:45
294,CoronavirusCA,g1iy3y,"New York, California lawmakers call for state ban on 'wet markets' amid coronavirus",20,2020-04-15 02:06:26
295,CoronavirusUS,g1iycc,CDC and FEMA's plan for safely reopening America,1,2020-04-15 02:06:56
296,CoronavirusNewYork,g1j0hb,"New York, California lawmakers call for state ban on 'wet markets' amid coronavirus",2,2020-04-15 02:10:56
297,CoronavirusIllinois,g1j17k,Question about Mail,0,2020-04-15 02:12:20
298,CoronavirusUS,g1j2zp,"My roommate and I created a website to connect people with extra resources to essential workers in need! Kids toys, books, gift cards, personal care items, etc.",2,2020-04-15 02:15:38
299,CoronavirusUS,g1j4bs,"The website for Florida's Department of Economic Opportunity is being shut down every night, making it effectively impossible to claim unemployment benefits before they expire.",30,2020-04-15 02:18:07
300,CoronavirusUK,g1ja51,Handling the Coronavirus Dead Freezer Trucks are a Good Thing sorta,0,2020-04-15 02:28:57
301,CoronavirusUS,g1jb0q,"Leland Miller: “Look, here's your new paradigm. It is that there is no longer a failure allowed, bankruptcies are allowed, the government backstops everything and we're going to see how long that goes until the system implodes. So, there's your new paradigm.”",3,2020-04-15 02:30:37
302,CoronavirusNewYork,g1jb4n,13.5% of maternity patients tested COVID+,3,2020-04-15 02:30:51
303,CoronavirusUS,g1jeei,How do you see life playing out the rest of the year? Think we’ll still be stuck at home come November or so?,4,2020-04-15 02:37:02
304,CoronavirusUS,g1jf94,How coronavirus antibody tests work and why they matter | COVID-19 Special,1,2020-04-15 02:38:43
305,CoronavirusUS,g1jg9l,"(CO & WA) My elderly mother lives alone in WA, and I live in CO. Is it safe to go stay with her so I can get her groceries, meds, etc. or is it better to stay away?",2,2020-04-15 02:40:34
306,CoronavirusUS,g1jguw,How realistic is it really that people return to work on May 1st?,4,2020-04-15 02:41:45
307,CoronavirusUS,g1jket,"I need help seeing my mother, 14 day quarantine question.",1,2020-04-15 02:48:34
308,CoronavirusUS,g1jqs2,Rep. Matt Gaetz: US Taxpayers Funding Chinese Research Center In Wuhan,4,2020-04-15 03:00:54
309,CoronavirusUS,g1jsam,Women leaders are doing a disproportionately great job at handling the pandemic. So why aren't there more of them?,0,2020-04-15 03:03:48
310,CoronavirusUS,g1jvav,Opinion: Imagine how many lives could have been saved if Trump took the virus seriously from the start,0,2020-04-15 03:09:18
311,CoronavirusUS,g1jx4t,"""Essential Workers"" are not heroes, but hostages and victims of abuse with no help",2,2020-04-15 03:12:47
312,CoronavirusNewYork,g1k4su,"In chaotic times, NY governor Andrew Cuomo wants to convince you he is the calm, competent leader you need. It’s been effective — so effective you might miss that even in a pandemic, Cuomo is fighting to protect the rich and impose austerity, including devastating Medicaid cuts, on everyone else.",1,2020-04-15 03:28:08
313,CoronavirusUS,g1k4u3,"Today I walked past 2 people, chance of being infected?",1,2020-04-15 03:28:12
314,CoronavirusUS,g1kavj,Did she stumble upon the missing link to cure coronavirus with meds for her brain fluid leak?,0,2020-04-15 03:40:14
315,CoronavirusUS,g1kbdu,"Hey guys, I launched an online store today stocked with hand sanitizer, along with detailed lists of procedures of what to do and what not to do regarding family and individual health during this pandemic.",0,2020-04-15 03:41:12
