,subreddit,Pid,title,upvote,date
183,CoronavirusCA,g1yzkq,Re-opening California and Potential Increase in Cases,54,2020-04-15 19:33:36
184,CoronavirusUK,g1z1b0,What is update on coronavirus?,0,2020-04-15 19:36:00
185,CoronavirusUK,g1z2y8,Spain discussing when Brits can expect to holiday again after crisis,1,2020-04-15 19:38:18
186,CoronavirusUK,g1z9a1,Our daughters appreciation for our milkman,10,2020-04-15 19:47:30
187,CoronavirusUS,g1zb4t,Plans to reopen Texas will be announced on Friday,26,2020-04-15 19:50:18
188,CoronavirusNewYork,g1zc8m,Face makes to be required where social distancing not possible,0,2020-04-15 19:51:52
189,CoronavirusUS,g1zcjh,The U.S. population will possibly come to an end due to this virus,0,2020-04-15 19:52:20
190,CoronavirusUK,g1zds5,UK 'probably reaching' COVID-19 peak - but too soon to ease lockdown,3,2020-04-15 19:54:10
191,CoronavirusUK,g1zi2y,Crime in UK falls sharply since start of coronavirus lockdown,7,2020-04-15 20:00:18
192,CoronavirusUK,g1zjwh,"Father-of-eight dies of coronavirus aged just 34 after believing he had recovered from the killer infection as well-wishers raise more than £90,000 for his devastated family",6,2020-04-15 20:02:59
193,CoronavirusUS,g1zkp4,"A Petition demanding that Governor Ron DeSantis and the Florida Department Of Economic Opportunity (FLDEO) immediately release, implement, and disperse without delay the monetary resources which is stated in the Federal CARES ACT",8,2020-04-15 20:04:07
194,CoronavirusUS,g1zkt8,Remdesivir: Potential Repurposed Candidate for COVID-19,8,2020-04-15 20:04:17
195,CoronavirusUK,g1zln2,Coronavirus: Covid-19 diagnosed in 11-week-old baby,8,2020-04-15 20:05:31
196,CoronavirusUS,g20191,Why Are Rich Americans Getting $1.7 Million Stimulus Checks?,50,2020-04-15 20:27:28
197,CoronavirusUS,g202da,Donald Trump names WWE’s Vince McMahon as adviser to restart US economy,133,2020-04-15 20:29:04
198,CoronavirusUK,g2042o,Has anybody reported a Corona-virus violation? If so what was the outcome?,0,2020-04-15 20:31:32
199,CoronavirusUK,g2073v,British military suspected of concealing coronavirus outbreak,1,2020-04-15 20:36:11
200,CoronavirusNewYork,g207g7,"Coronavirus Conspiracy Discord. Bill gates, 5G, Bioweapons, WHO, Aliens",0,2020-04-15 20:36:40
201,CoronavirusUS,g20bdz,Company forced to kill up to 2M chickens that won't reach market due to staffing shortages,14,2020-04-15 20:42:29
202,CoronavirusNewYork,g20dc3,Mourning a 'supermom': U.S. health worker casualties mount in virus fight,11,2020-04-15 20:45:27
203,CoronavirusUS,g20g6b,Is the travel ban still in place?,1,2020-04-15 20:49:52
204,CoronavirusUS,g20h2k,Medical device “jailbreak” could help solve the dangerous shortage of ventilators,7,2020-04-15 20:51:13
205,CoronavirusUS,g20n66,"I woke up to honking today only to find it's too dangerous to go outside, but not because of the virus.",88,2020-04-15 21:00:18
206,CoronavirusUS,g20nz8,"Atlanta police searching for woman who filmed herself coughing on family of 6, possibly as part of a ‘social media challenge’",40,2020-04-15 21:01:29
207,CoronavirusUS,g20wdr,"We Alerted The World' To Coronavirus On Jan. 5, WHO Says In Response To U.S.",18,2020-04-15 21:13:42
208,CoronavirusUS,g20wj8,"As officials says the COVID19 curve is flattening. USA reported 27,413 coronavirus cases & 2,336 deaths so far today.",5,2020-04-15 21:13:57
209,CoronavirusUS,g20wsk,How long does it take someone to die if they have corona?,1,2020-04-15 21:14:19
210,CoronavirusUS,g20xk5,'Lock her up!': Anti-Whitmer coronavirus lockdown protestors swarm Michigan Capitol,1,2020-04-15 21:15:22
211,CoronavirusNewYork,g20y6b,Will Upstate NY be back to work and school by May? Low infection rates etc.,7,2020-04-15 21:16:19
212,CoronavirusUK,g20zlq,Artists painting murals in lockdown? Thoughts?,0,2020-04-15 21:18:30
213,CoronavirusUS,g20zs8,Gov. Hogan of Maryland issues an Executive Order mandating the use of face coverings in public settings.,18,2020-04-15 21:18:48
214,CoronavirusUS,g20zzi,Tennessee Governor Recommends Closing Schools for the Remainder of the School Year,1,2020-04-15 21:19:09
215,CoronavirusUS,g210q3,"Decode Genetics helped Iceland test more than 10% of its population, CEO says it should be even easier in the US",4,2020-04-15 21:20:18
216,CoronavirusUK,g21107,Church of England moves valuables to Tower of London amid fears of looting,6,2020-04-15 21:20:45
217,CoronavirusUS,g211hm,‘It Really Is the Perfect Storm’: Coronavirus Comes for Rural America,2,2020-04-15 21:21:28
218,CoronavirusUS,g213oc,"Mayor Goodman calls shutdown ‘total insanity,’ wants businesses reopened",10,2020-04-15 21:24:48
219,CoronavirusUK,g214bm,The Trump Show - 15/4 Coronavirus Press Conference,0,2020-04-15 21:25:48
220,CoronavirusNewYork,g214jx,When do you think Gov Cuomo announce extension of school and non-essential biz closures beyond April 29th?,4,2020-04-15 21:26:10
221,CoronavirusUS,g216gx,Request: Any links to footage of the madness in the hospitals?,0,2020-04-15 21:28:59
222,CoronavirusUK,g2185o,Care home reality,61,2020-04-15 21:31:31
223,CoronavirusUS,g2185q,Google's Wear OS adds reminder to wash hands to prevent COVID-19,2,2020-04-15 21:31:32
224,CoronavirusUS,g21adn,"I was searching for information on how predictive modeling has developed over time and couldn’t find what I wanted, so I made it myself. Let me know if you find this useful.",3,2020-04-15 21:34:52
225,CoronavirusUS,g21ax5,What happens in New York?,2,2020-04-15 21:35:38
226,CoronavirusUK,g21dai,Warning as coronavirus outbreak leads to sharp rise in deaths at home.,7,2020-04-15 21:38:57
227,CoronavirusCA,g21gwt,"As worries mount over US food supply chain, now’s the time to prepare for possible shortages.",0,2020-04-15 21:44:20
228,CoronavirusUS,g21h4t,The tech ‘solutions’ for coronavirus take the surveillance state to the next level,8,2020-04-15 21:44:38
229,CoronavirusUS,g21id3,Question for Americans.,1,2020-04-15 21:46:30
230,CoronavirusUS,g21in7,"So Joe Rogan has a private doctor doing testing at his home. He's already been tested twice. Meanwhile, health care workers still can't get tested.",6,2020-04-15 21:46:58
231,CoronavirusCA,g21klk,California offering $500 in coronavirus relief to undocumented immigrants,355,2020-04-15 21:49:54
232,CoronavirusUS,g21mdh,"In unprecedented move, Treasury orders Trump’s name printed on stimulus checks",4,2020-04-15 21:52:31
233,CoronavirusCA,g21o9q,Santa Cruz County may ease shelter-in-place restrictions May 4,17,2020-04-15 21:55:16
234,CoronavirusUK,g21xdv,"UK government has no exit plan for Covid-19 lockdown, say sources",1,2020-04-15 22:08:38
235,CoronavirusUS,g21zbu,"U.S. coronavirus deaths top 30,000",24,2020-04-15 22:11:26
236,CoronavirusUS,g22069,"Interesting , Fox news , any way we can verify?",3,2020-04-15 22:12:40
237,CoronavirusUK,g220yi,Temporal dynamics in viral shedding and transmissibility of COVID-19,2,2020-04-15 22:13:56
238,CoronavirusUK,g2229m,Household Secondary Attack Rate of COVID-19 and Associated Determinants,1,2020-04-15 22:15:48
239,CoronavirusUK,g225rz,Matt Hancock says lack of testing is down to “not enough demand”,15,2020-04-15 22:21:06
240,CoronavirusUS,g229tu,This is what it will take to get us back outside,2,2020-04-15 22:27:13
241,CoronavirusUS,g22ati,Doctor David Moon Believes VanDOit's EverShower May Help Lower Risk of Exposing Others to COVID-19,2,2020-04-15 22:28:43
242,CoronavirusCA,g1nvnj,"Peninsula police officer recovers from COVID-19, will donate plasma",10,2020-04-15 08:19:47
243,CoronavirusUS,g22fjr,Gravitas: 5 questions WHO must answer | Wuhan Coronavirus,2,2020-04-15 22:36:02
244,CoronavirusUK,g22gmn,Any UK NHS workers in need of KN95 (FFP2) masks?,5,2020-04-15 22:37:43
245,CoronavirusUK,g22ixn,"Coffee shops, estate agents and restaurants ‘to be first to re-open’ when easing lockdown restrictions",1,2020-04-15 22:41:12
246,CoronavirusCA,g22o1j,Santa Clara County—Not S.F.—Was Ahead of the Curve with Public Health Mandate,38,2020-04-15 22:48:58
247,CoronavirusUS,g22o1o,Los Angeles mayor says large gatherings like concerts and sporting events may not come back until 2021,47,2020-04-15 22:48:58
248,CoronavirusUS,g22peg,"Coronavirus cases at South Dakota meatpacking plant surpass 540, make up 55 percent of all cases in the state",23,2020-04-15 22:51:02
249,CoronavirusNewYork,g22q2a,For those able to #serve: NYC Health + Hospitals is looking to fill 500 non-clinical positions immediately including:,10,2020-04-15 22:52:05
250,CoronavirusUS,g22tjo,The economic data is even worse than Wall Street feared: 'The economy is clearly in ruins here',27,2020-04-15 22:57:12
251,CoronavirusUS,g22v3l,Free COVID-19 tests for all Tennesseans available starting Saturday,12,2020-04-15 22:59:32
252,CoronavirusUS,g22vxw,Does anyone know why it's saying this.,1,2020-04-15 23:00:51
253,CoronavirusUS,g22xhm,"Brazil has found the cure, but won't reveal what it is for a month. In related news: ""The Coronavirus hates this one simple trick!""",2,2020-04-15 23:03:12
254,CoronavirusUS,g22y07,2 million slaughtered chickens can’t be sold during coronavirus pandemic,27,2020-04-15 23:04:03
255,CoronavirusUS,g22zrv,"John Hopkins now has county-by-county presentation for USA, superior to most state dashboards",12,2020-04-15 23:06:42
256,CoronavirusUS,g202da,Donald Trump names WWE’s Vince McMahon as adviser to restart US economy,128,2020-04-15 20:29:04
257,CoronavirusUK,g2042o,Has anybody reported a Corona-virus violation? If so what was the outcome?,0,2020-04-15 20:31:32
258,CoronavirusUS,g20bdz,Company forced to kill up to 2M chickens that won't reach market due to staffing shortages,13,2020-04-15 20:42:29
259,CoronavirusNewYork,g20dc3,Mourning a 'supermom': U.S. health worker casualties mount in virus fight,12,2020-04-15 20:45:27
260,CoronavirusUS,g20g6b,Is the travel ban still in place?,1,2020-04-15 20:49:52
261,CoronavirusUS,g20h2k,Medical device “jailbreak” could help solve the dangerous shortage of ventilators,7,2020-04-15 20:51:13
262,CoronavirusUS,g20nz8,"Atlanta police searching for woman who filmed herself coughing on family of 6, possibly as part of a ‘social media challenge’",38,2020-04-15 21:01:29
263,CoronavirusUS,g20wdr,"We Alerted The World' To Coronavirus On Jan. 5, WHO Says In Response To U.S.",21,2020-04-15 21:13:42
264,CoronavirusUS,g20wj8,"As officials says the COVID19 curve is flattening. USA reported 27,413 coronavirus cases & 2,336 deaths so far today.",6,2020-04-15 21:13:57
265,CoronavirusNewYork,g20y6b,Will Upstate NY be back to work and school by May? Low infection rates etc.,7,2020-04-15 21:16:19
266,CoronavirusUK,g20zlq,Artists painting murals in lockdown? Thoughts?,0,2020-04-15 21:18:30
267,CoronavirusUS,g20zs8,Gov. Hogan of Maryland issues an Executive Order mandating the use of face coverings in public settings.,17,2020-04-15 21:18:48
268,CoronavirusUS,g210q3,"Decode Genetics helped Iceland test more than 10% of its population, CEO says it should be even easier in the US",4,2020-04-15 21:20:18
269,CoronavirusUK,g21107,Church of England moves valuables to Tower of London amid fears of looting,7,2020-04-15 21:20:45
270,CoronavirusUS,g211hm,‘It Really Is the Perfect Storm’: Coronavirus Comes for Rural America,2,2020-04-15 21:21:28
271,CoronavirusUS,g213oc,"Mayor Goodman calls shutdown ‘total insanity,’ wants businesses reopened",10,2020-04-15 21:24:48
272,CoronavirusNewYork,g214jx,When do you think Gov Cuomo announce extension of school and non-essential biz closures beyond April 29th?,4,2020-04-15 21:26:10
273,CoronavirusUK,g2185o,Care home reality,63,2020-04-15 21:31:31
274,CoronavirusUS,g2185q,Google's Wear OS adds reminder to wash hands to prevent COVID-19,2,2020-04-15 21:31:32
275,CoronavirusUS,g21adn,"I was searching for information on how predictive modeling has developed over time and couldn’t find what I wanted, so I made it myself. Let me know if you find this useful.",3,2020-04-15 21:34:52
276,CoronavirusUK,g21dai,Warning as coronavirus outbreak leads to sharp rise in deaths at home.,7,2020-04-15 21:38:57
277,CoronavirusCA,g21gwt,"As worries mount over US food supply chain, now’s the time to prepare for possible shortages.",0,2020-04-15 21:44:20
278,CoronavirusUS,g21h4t,The tech ‘solutions’ for coronavirus take the surveillance state to the next level,9,2020-04-15 21:44:38
279,CoronavirusCA,g21klk,California offering $500 in coronavirus relief to undocumented immigrants,349,2020-04-15 21:49:54
280,CoronavirusCA,g21o9q,Santa Cruz County may ease shelter-in-place restrictions May 4,17,2020-04-15 21:55:16
281,CoronavirusUK,g21xdv,"UK government has no exit plan for Covid-19 lockdown, say sources",2,2020-04-15 22:08:38
282,CoronavirusUS,g21zbu,"U.S. coronavirus deaths top 30,000",24,2020-04-15 22:11:26
283,CoronavirusUS,g22069,"Interesting , Fox news , any way we can verify?",2,2020-04-15 22:12:40
284,CoronavirusUK,g220yi,Temporal dynamics in viral shedding and transmissibility of COVID-19,2,2020-04-15 22:13:56
285,CoronavirusUK,g2229m,Household Secondary Attack Rate of COVID-19 and Associated Determinants,1,2020-04-15 22:15:48
286,CoronavirusUK,g225rz,Matt Hancock says lack of testing is down to “not enough demand”,15,2020-04-15 22:21:06
287,CoronavirusUS,g229tu,This is what it will take to get us back outside,2,2020-04-15 22:27:13
288,CoronavirusCA,g1nvnj,"Peninsula police officer recovers from COVID-19, will donate plasma",7,2020-04-15 08:19:47
289,CoronavirusUK,g22gmn,Any UK NHS workers in need of KN95 (FFP2) masks?,4,2020-04-15 22:37:43
290,CoronavirusUK,g22ixn,"Coffee shops, estate agents and restaurants ‘to be first to re-open’ when easing lockdown restrictions",0,2020-04-15 22:41:12
291,CoronavirusCA,g22o1j,Santa Clara County—Not S.F.—Was Ahead of the Curve with Public Health Mandate,36,2020-04-15 22:48:58
292,CoronavirusUS,g22o1o,Los Angeles mayor says large gatherings like concerts and sporting events may not come back until 2021,42,2020-04-15 22:48:58
293,CoronavirusUS,g22peg,"Coronavirus cases at South Dakota meatpacking plant surpass 540, make up 55 percent of all cases in the state",23,2020-04-15 22:51:02
294,CoronavirusNewYork,g22q2a,For those able to #serve: NYC Health + Hospitals is looking to fill 500 non-clinical positions immediately including:,9,2020-04-15 22:52:05
295,CoronavirusUS,g22tjo,The economic data is even worse than Wall Street feared: 'The economy is clearly in ruins here',25,2020-04-15 22:57:12
296,CoronavirusUS,g22v3l,Free COVID-19 tests for all Tennesseans available starting Saturday,10,2020-04-15 22:59:32
297,CoronavirusUS,g22y07,2 million slaughtered chickens can’t be sold during coronavirus pandemic,25,2020-04-15 23:04:03
298,CoronavirusUS,g22zrv,"John Hopkins now has county-by-county presentation for USA, superior to most state dashboards",11,2020-04-15 23:06:42
299,CoronavirusUK,g2305l,"Pregnant NHS nurse, 28, dies of coronavirus but baby is saved after c-section",5,2020-04-15 23:07:18
300,CoronavirusUS,g2328p,Social Distancing and Seriouness of this Situation,21,2020-04-15 23:10:32
301,CoronavirusUK,g235d1,"Three temporary mortuaries to be installed in Sussex. The largest of which will be at my old uni, the University of Sussex",7,2020-04-15 23:15:30
302,CoronavirusUS,g236ri,Steve Mnuchin states that the stimulus package should support Americans for 10 weeks.,43,2020-04-15 23:17:40
303,CoronavirusUK,g236tv,How healthcare workers de-stress during the coronavirus outbreak,9,2020-04-15 23:17:46
304,CoronavirusUK,g23be2,UK retail sales drop by a quarter in first two weeks of lockdown,4,2020-04-15 23:24:45
305,CoronavirusNewYork,g23ecx,"""Capitalism is the Virus"" graffiti in New Orleans",42,2020-04-15 23:29:21
306,CoronavirusUS,g23nyu,Protesters clog streets in Michigan over Whitmer coronavirus stay-home order,7,2020-04-15 23:43:41
307,CoronavirusUS,g23oxf,Sorry if this is a silly or petty question. I can remove it. But I’m just curious to know from informed people when actual dating might resume again.,2,2020-04-15 23:45:16
308,CoronavirusUS,g23qfp,Protestors against the stay-at-home order in Michigan block streets leading to Sparrow Hospital,44,2020-04-15 23:47:36
309,CoronavirusUS,g23qi0,COVID shut down extended until at least June. Do you think riots are in our future?,3,2020-04-15 23:47:42
310,CoronavirusNewYork,g23qq1,Medical device “jailbreak” could help solve the dangerous shortage of ventilators,2,2020-04-15 23:48:02
311,CoronavirusUK,g23r6c,Anyone else having these awful thoughts and feelings?,2,2020-04-15 23:48:45
312,CoronavirusUS,g23rbv,History doesn’t lie,1159,2020-04-15 23:49:00
313,CoronavirusUS,g23vht,Protestors against the stay-at-home order in Michigan block streets leading to Sparrow Hospital,12,2020-04-15 23:55:42
314,CoronavirusUS,g242a3,"What's up with S. Dakota? Are they just not reporting numbers now? Been like this for a while, it seems unbelievable to me that people are not dying.",5,2020-04-16 00:06:57
315,CoronavirusUS,g247jz,A mother in New York was cheered on by hospital staff as she met her newborn baby after recovering from coronavirus. She spent 11 days on a ventilator,42,2020-04-16 00:15:56
316,CoronavirusUS,g24i9t,Lake Tahoe: all national forest recreation areas and sites in the South Shore Recreation Corridors are now closed. Been too crowded. People were told not to go there - and they didn't listen...,10,2020-04-16 00:33:40
317,CoronavirusUK,g24vlf,Help researchers understand how the COVID-19 Pandemic is affecting you!,2,2020-04-16 00:55:53
318,CoronavirusUK,g24w54,I can't sleep thoughts,1,2020-04-16 00:56:47
319,CoronavirusUK,g250lr,"Fatality per capita in England is more than double that of Scotland, Wales or Norther Ireland. UK is now the forth highest affected country in Europe.",5,2020-04-16 01:04:33
320,CoronavirusUK,g2510c,"Daily Discussion Megathread - April 16 | Questions, images, videos, comments, unconfirmed reports, theories, suggestions",1,2020-04-16 01:05:15
321,CoronavirusCA,g21gjj,"California Fish and Game Commission Meets Remotely, Allows CDFW to Temporarily Delay, Restrict or Suspend Fisheries Where Needed to Prevent the Spread of Coronavirus",3,2020-04-15 21:43:46
322,CoronavirusUS,g257cp,Los Angeles mayor says large gatherings like concerts and sporting events may not come back until 2021,9,2020-04-16 01:16:16
323,CoronavirusUK,g258l9,Coronavirus Group Chat,2,2020-04-16 01:18:19
324,CoronavirusUK,g25clq,"Created a 3D animation to help everyone stay safe from Covid 19, feedback is appreciated!",1,2020-04-16 01:25:32
325,CoronavirusNewYork,g25gnd,Where to sell 3M N95 1860 masks? Also is anyone in need of them?,0,2020-04-16 01:32:46
326,CoronavirusNewYork,g25jk9,"U.S. Military Investigations Suggest COVID-19 Probably Wasn't Created in a Lab, Chairman of Joint Chief Says",6,2020-04-16 01:37:47
327,CoronavirusNewYork,g25k6p,"Created a 3D animation to help everyone stay safe from Covid 19, feedback is appreciated!",1,2020-04-16 01:38:58
328,CoronavirusNewYork,g25o23,MIT study: Subways a 'major disseminator' of coronavirus in NYC,8,2020-04-16 01:45:52
329,CoronavirusCA,g25udg,Why are there no categorizations by age in California?,4,2020-04-16 01:57:17
330,CoronavirusNewYork,g25uuz,Intelligence officials weigh possibility coronavirus escaped from a Chinese lab,14,2020-04-16 01:58:11
331,CoronavirusUK,g25v3t,7 day rolling average cases and deaths. Suggests UK wont reach its peak (Deaths)for a while as confirmed cases are still rising,5,2020-04-16 01:58:38
332,CoronavirusUS,g25wcx,Arizona Department of Corrections not releasing number of positive tests of officers,6,2020-04-16 02:00:59
333,CoronavirusUS,g25xrj,Will coronavirus spike if Arizona reopens April 30?,2,2020-04-16 02:03:35
334,CoronavirusUK,g25z1p,Daily Rant & Vent Megathread - April 16,1,2020-04-16 02:05:49
335,CoronavirusUS,g260wl,It's a bit complicated': Delayed COVID-19 test results make it difficult to understand the spread in Arizona,8,2020-04-16 02:09:04
336,CoronavirusNewYork,g260y6,Exclusive: New York taps McKinsey to develop 'Trump-proof' economic reopening plan,13,2020-04-16 02:09:07
337,CoronavirusNewYork,g262k6,"All NYC Subways, Buses & Ferries Will Blast Horns In Solidarity With Transportation Workers This Thursday - Secretnyc",12,2020-04-16 02:12:01
338,CoronavirusNewYork,g26b13,"Who thinks this is a golden opportunity for Future to remix ""Mask Off"" to Mask On",2,2020-04-16 02:27:44
339,CoronavirusUS,g26c25,New York to require all people to wear masks when in public,20,2020-04-16 02:29:38
340,CoronavirusNewYork,g26dcw,"ncov19 | Coronavirus COVID-19 Tracker with Testing Centers, SARS-COV-2 Vaccine Information, and SMS notification.",1,2020-04-16 02:32:09
341,CoronavirusUK,g26i6a,US is investigating if 'COVID-19 accidentally leaked from Wuhan lab where patient zero worked' and China blamed the wet market as a cover-up,1,2020-04-16 02:41:06
342,CoronavirusUS,g26j8g,somewhat prophetic Explained episode?,2,2020-04-16 02:43:01
343,CoronavirusUS,g26jqk,"Finally, large scale trustworthy antibody tests are here!",15,2020-04-16 02:43:58
344,CoronavirusUS,g26m0j,"USA reported 30,206 #Covid_19 cases & 2,482 deaths. Totaling to 644,089 cases & 28,529 deaths. Cases by State in link.",1,2020-04-16 02:48:24
345,CoronavirusUS,g26n3q,"So, according to John Hopkins' Covid-19 map for the U.S., Florida and Louisiana have bent their curve a lot",5,2020-04-16 02:50:35
346,CoronavirusUS,g26n5o,Here is yet another article about melatonin being helpful in Corona.,1,2020-04-16 02:50:42
347,CoronavirusUS,g26rbq,Warmer weather- reasonable or ridiculous?,1,2020-04-16 02:58:30
348,CoronavirusUS,g26rhj,"Coronavirus can remain in air up to 3 hours, on surfaces for days.. and more information",1,2020-04-16 02:58:49
349,CoronavirusUS,g26td9,My Quarantine Partner.... I'm lucky not to be totally alone.,4,2020-04-16 03:02:07
350,CoronavirusUS,g26tf5,Some good perspective on refrigerated trucks and media hype.,0,2020-04-16 03:02:12
351,CoronavirusUS,g26tns,Zoom,0,2020-04-16 03:02:39
352,CoronavirusUS,g26vic,"Can someone who had COVID-19 and recovered still transmit the virus to someone else if they are exposed to the virus again, even if they themselves will not get sick again?",1,2020-04-16 03:06:02
353,CoronavirusUK,g26x6v,The importance of masks: a high-speed photo,1,2020-04-16 03:09:08
354,CoronavirusUS,g270hv,Reuters: Exclusive: New York taps McKinsey to develop 'Trump-proof' economic reopening plan.,3,2020-04-16 03:15:29
355,CoronavirusUK,g272x6,"Real-Time Information for Covid -19 done by University of New Haven, USA",1,2020-04-16 03:20:02
356,CoronavirusUK,g1zds5,UK 'probably reaching' COVID-19 peak - but too soon to ease lockdown,3,2020-04-15 19:54:10
357,CoronavirusUK,g1zi2y,Crime in UK falls sharply since start of coronavirus lockdown,6,2020-04-15 20:00:18
358,CoronavirusUK,g1zjwh,"Father-of-eight dies of coronavirus aged just 34 after believing he had recovered from the killer infection as well-wishers raise more than £90,000 for his devastated family",8,2020-04-15 20:02:59
359,CoronavirusUS,g1zkp4,"A Petition demanding that Governor Ron DeSantis and the Florida Department Of Economic Opportunity (FLDEO) immediately release, implement, and disperse without delay the monetary resources which is stated in the Federal CARES ACT",8,2020-04-15 20:04:07
360,CoronavirusUS,g1zkt8,Remdesivir: Potential Repurposed Candidate for COVID-19,9,2020-04-15 20:04:17
361,CoronavirusUK,g1zln2,Coronavirus: Covid-19 diagnosed in 11-week-old baby,6,2020-04-15 20:05:31
362,CoronavirusUS,g20191,Why Are Rich Americans Getting $1.7 Million Stimulus Checks?,52,2020-04-15 20:27:28
363,CoronavirusNewYork,g275ka,Idk if I’m stressing out for no reason or what.,1,2020-04-16 03:24:55
