,subreddit,Pid,title,upvote,date
0,CoronavirusUK,g1nxkh,"UK was too slow to act on COVID-19 initially, opposition Labour leader says",199,2020-04-15 08:24:17
1,CoronavirusUK,g1o0p1,Jury still out on Swedish coronavirus strategy,5,2020-04-15 08:31:33
2,CoronavirusUK,g1o4yr,NHS Volunteer Scheme,3,2020-04-15 08:41:28
3,CoronavirusUK,g1o60x,Britain 'facing worst recession in 300 years' if lockdown lasts until summer,10,2020-04-15 08:43:54
4,CoronavirusUS,g1o6da,China urges United States to fulfill its obligations to WHO,2,2020-04-15 08:44:43
5,CoronavirusUK,g1o8l5,Pressure to re open primary schools by May.,16,2020-04-15 08:50:05
6,CoronavirusUK,g1of5k,UK lenders provide 1.1 billion pounds in emergency COVID loans,8,2020-04-15 09:05:46
7,CoronavirusNewYork,g1ot7p,"President Trump criticises World Health Organisation on covid-19 pandemic, announces to halt funding. The US is the largest donor to the WHO by far and makes its contribution annually.",1,2020-04-15 09:37:36
8,CoronavirusUK,g1ovpm,Just had a free food parcel delivered from the government due to being 'at risk'!,901,2020-04-15 09:43:30
9,CoronavirusUK,g1p92g,COVID-19 vaccine Phase II trials underway in Wuhan,8,2020-04-15 10:14:43
10,CoronavirusUK,g1pgwh,I got tested this morning- some thoughts,34,2020-04-15 10:32:42
11,CoronavirusUK,g1phsn,Denmark proposes faster easing of lockdown as coronavirus cases fall,0,2020-04-15 10:34:54
12,CoronavirusUK,g1pn0y,Parking permit for NHS Goodsam app volunteers,11,2020-04-15 10:46:45
13,CoronavirusUS,g1po3q,First March Without School Shooting Since 2002,119,2020-04-15 10:48:37
14,CoronavirusUS,g1ppjo,Americans are not seeing the same coronavirus news,128,2020-04-15 10:51:41
15,CoronavirusUK,g1przq,Keir Starmer calls for ministers to set out plans to end lockdown | World news,6,2020-04-15 10:57:30
16,CoronavirusUS,g1ps5g,"Check on the status of your Economic Impact Payment This application will give you information about: Your payment status Your payment type Whether we need more information from you, including bank account information",60,2020-04-15 10:57:53
17,CoronavirusUK,g1puus,Employer expects me to work while furloughed,10,2020-04-15 11:03:53
18,CoronavirusUK,g1pw9e,New Forest fitness instructor dies from Covid-19 - just days after it killed her mother,15,2020-04-15 11:07:03
19,CoronavirusUK,g1pyyv,Germany: Lawyer detained in psychiatric clinic after calling for anti-lockdown demonstration,5,2020-04-15 11:12:58
20,CoronavirusUK,g1pz9u,How COVID-19 Immunity Testing Can Help People Get Back To Work,4,2020-04-15 11:13:38
21,CoronavirusUK,g1o6sm,"""Wasted"" - 50 Million Pints Down The Drain Unless UK Pubs Reopen By Summer",9,2020-04-15 08:45:44
22,CoronavirusUK,g1q3oj,"Coronavirus distancing may need to continue until 2022, say experts",0,2020-04-15 11:23:59
23,CoronavirusUK,g1q50g,Why Scotland’s businesses may go bust in lockdown while English rivals survive – Murdo Fraser MSP,3,2020-04-15 11:26:58
24,CoronavirusUS,g1q5bi,Bill Gates says Trump's decision to halt WHO funding is 'as dangerous as it sounds,226,2020-04-15 11:27:39
25,CoronavirusUK,g1q5fo,Coming out of lockdown,2,2020-04-15 11:27:55
26,CoronavirusUK,g1q5ia,The COVID crisis. Governments around the world are spending hundreds of billions to help their economies. But what does a trillion dollars look like? This graphic is using $100 dollar bills. UK borrowing expected to increase by a third of a trillion dollars in 2020.,4,2020-04-15 11:28:07
27,CoronavirusUK,g1qagh,On a positive note my mum just got her first weekly care package as she’s considered a vulnerable adult and I’ve also been granted furlough by my employer - words can’t express how grateful we both are that the UK government is taking steps towards looking out for people at a time like this,178,2020-04-15 11:38:50
28,CoronavirusUS,g1qcbj,The Food Expiration Dates You Should Actually Follow,44,2020-04-15 11:42:39
29,CoronavirusUS,g1qcst,Prominent scientists have bad news for the White House about coronavirus antibody tests,52,2020-04-15 11:43:45
30,CoronavirusUS,g1qduf,"Mayor Jane Castor unveils One Tampa fund for residents and businesses struggling due to coronavirus (In Florida): 'we will directly pay their landlord or bank up to a $1000 for late or forthcoming rent or mortgage, and we will cover the cost of their utilities up to $250.'",33,2020-04-15 11:46:06
31,CoronavirusUS,g1qg7t,Researchers warn the COVID-19 lockdown will take its own toll on health,18,2020-04-15 11:51:04
32,CoronavirusUK,g1qiss,Was the virus in the UK earlier than we think? This was my timeline from Jan.,0,2020-04-15 11:56:18
33,CoronavirusUK,g1qlr4,Until a vaccine becomes available there is evidence masks may safe lives: A petition for mandatory face masks in the U.K.,4,2020-04-15 12:02:04
34,CoronavirusUK,g1qmql,Nicola Sturgeon tells @GMB that she accepts assurances that NHS England did not demand PPE suppliers give preference to England over Scotland.,10,2020-04-15 12:03:58
35,CoronavirusUS,g1r4rv,"In light of COVID-19, how is the safety of going to food pantries/banks in hot spot areas?",6,2020-04-15 12:39:11
36,CoronavirusUK,g1r70p,Why has the dialogue changed so suddenly?,45,2020-04-15 12:43:13
37,CoronavirusUS,g1ra7e,[04.15.2020] Updated latest Predictions char by Associate Professor SQ Yang from UOW,8,2020-04-15 12:49:30
38,CoronavirusUK,g1rdsa,Coronavirus: Three chances missed to buy protective equipment,11,2020-04-15 12:56:13
39,CoronavirusUK,g1rid2,Google Bans Ads Related To 5G Coronavirus Conspiracy Theories,7,2020-04-15 13:04:01
40,CoronavirusUK,g1riul,New UK deaths announced 15th April 2020,26,2020-04-15 13:04:51
41,CoronavirusUS,g1rk99,Ending coronavirus lockdowns will be a dangerous process of trial and error,24,2020-04-15 13:07:23
42,CoronavirusUK,g1rm2x,Myths and Facts Of COVID-19 [TOP 7] - 247techclub,0,2020-04-15 13:10:35
43,CoronavirusUS,g1rmbw,"Best Buy stores just laid off 51,000 people due to COVID. All part time workers and 20% of their full timers. Corporate staff are taking 20%-50% pay cut. Most employees have not even been told yet that their last day is Saturday and had to find out from an article posted online.",298,2020-04-15 13:11:03
44,CoronavirusUK,g1rmvf,"""All patients being discharged from hospital into a care home will now automatically be tested for coronavirus, the spokesman said""",13,2020-04-15 13:11:59
45,CoronavirusUS,g1rr1i,Opinion (T/W): increase in suicide if social distancing is pushed to 2022?,13,2020-04-15 13:19:16
46,CoronavirusUS,g1rr4n,"Why people are so anxious to get tested for C-19? What's the underlying reason to spend night(s) in cars (the NJ example) not even knowing if you get tested or not? Why don't just sit home, relax, drink plenty of fluids, eat chicken broth? Not that there are medals ""I had a Corona-19""...",5,2020-04-15 13:19:25
47,CoronavirusUK,g1rszn,"NEW POLLING: 37% of Brits have seen social media content promoting conspiracy theory that 5G is to blame for COVID-19, 8% believe the conspiracy theory, a further 19% aren't sure that the conspiracy theory is untrue",3,2020-04-15 13:22:37
48,CoronavirusUK,g1ruaa,"UK economy could shrink by 35% with 2m job losses, warns OBR",5,2020-04-15 13:24:49
49,CoronavirusUK,g1rvox,UK Column News - 15th April 2020: The Imperial College Bill Gates Connec...,0,2020-04-15 13:27:09
50,CoronavirusUK,g1rza6,"Cases down and deaths lower from yesterday,hopefully this trend continues",49,2020-04-15 13:33:06
51,CoronavirusUS,g1s1oo,An interesting glimpse into history... We’ll get through this! 🇺🇸 Stay strong & stay safe!,8,2020-04-15 13:37:00
52,CoronavirusUK,g1s1p2,"Woman, 106, believed to be UK's oldest patient to recover from COVID-19 leaves hospital",16,2020-04-15 13:37:02
53,CoronavirusUK,g1s3go,Can anyone confirm if the Corona virus job retention scheme (CJRS) dates have changed to include employees that started before the 19th of March?,0,2020-04-15 13:40:02
54,CoronavirusUK,g1s4ff,Stats 15/04,22,2020-04-15 13:41:35
55,CoronavirusUS,g1s4i3,Using VFX to Explain Why COVID-19 Surprised Everyone,12,2020-04-15 13:41:43
56,CoronavirusUS,g1s72i,"St Pete Mayor (Florida) Begins ""Call From City Hall"" Initiative. “I think the idea behind this was just to let people in our community know, especially those that might find themselves in that situation, that we care about them,” Kriseman explained.",12,2020-04-15 13:45:45
57,CoronavirusUK,g1s9qe,There has been a considerable rise in Non-Covid related Home and Care Home deaths in Scotland,29,2020-04-15 13:50:06
58,CoronavirusUS,g1sapq,"Here's how the virus spreads if everyone visits ""just one friend""",44,2020-04-15 13:51:37
59,CoronavirusUK,g1scne,Difficult to think that this was 5th March. So much has changed.,23,2020-04-15 13:54:38
60,CoronavirusUS,g1sfcy,Tennessee keeps nursing homes' COVID-19 numbers secret,77,2020-04-15 13:58:58
61,CoronavirusNewYork,g1sfl8,Where are you getting cleaning supplies?,8,2020-04-15 13:59:19
62,CoronavirusUK,g1sj8b,Told to self-isolate paid only 94 pounds,11,2020-04-15 14:04:56
63,CoronavirusNewYork,g1sst5,"CDC Director reacts to trump blaming WHO, Dr. Robert Redfield addresses the president's decision to cut funding to the world health organisation as well as states working to ease restrictions and the key to preventing a second wave.",2,2020-04-15 14:19:51
64,CoronavirusUS,g1sv1k,Stimulus/Financial/Economic Questions - Ask + Answer HERE,8,2020-04-15 14:23:19
65,CoronavirusUK,g1sowp,"Chart of UK hospital deaths to 14th April, log scaling",9,2020-04-15 14:13:51
66,CoronavirusUK,g1swj4,"14th April - UK's daily death toll compared with Italy's, Spain's, France's and Germany's",150,2020-04-15 14:25:35
67,CoronavirusNewYork,g1t1x0,Banks authorized to grab stimulus checks off their customers,5,2020-04-15 14:33:29
68,CoronavirusUK,g1t36b,The checkout girl at my local shop stated that the lockdown will end on the 16 June.,0,2020-04-15 14:35:22
69,CoronavirusCA,g1t3bd,"Check here for the status on your stimulus check, or update bank info! Get My Payment just went live today",132,2020-04-15 14:35:33
70,CoronavirusUS,g1tcq9,Marine barbershops abuzz with demand for high-and-tight cuts,4,2020-04-15 14:49:40
71,CoronavirusUK,g1tcx7,A nice metaphor regarding the logic of easing the lockdown,36,2020-04-15 14:49:58
72,CoronavirusUK,g1tdwl,"April 15 NHS England deaths by actual day chart, now including ONS data",86,2020-04-15 14:51:24
73,CoronavirusCA,g1tsib,Bay Are Coffee Company Donates Profits to WHO,14,2020-04-15 15:12:12
74,CoronavirusUS,g1tssy,2k Monthly Stimulus Check Proposal... Wishful thinking?,10,2020-04-15 15:12:37
75,CoronavirusUS,g1tu7j,(US) Is there a website to anonymously name companies who screw/take advantage of workers during the outbreak?,102,2020-04-15 15:14:36
76,CoronavirusUK,g1tuvi,I've just received a letter (dated 23 March!) stating I am 'at a higher risk' due to health conditions etc. This is jointly from my council and CCG. Does this mean I'm in the shielding group or did they send letters to the vunerable group (i.e. the flu shot lot) as well. I'm confused.,11,2020-04-15 15:15:35
77,CoronavirusUS,g1twfu,Stimulus Check could be delayed so that Trump’s name can be printed on them.,33,2020-04-15 15:17:52
78,CoronavirusNewYork,g1tz1o,Why stock-market investors may be asking the ‘wrong question’ about coronavirus and reopening the economy - MarketWatch,2,2020-04-15 15:21:43
79,CoronavirusCA,g1u042,What do you think of this article saying we possibly will social distance until 2022?,16,2020-04-15 15:23:09
80,CoronavirusUS,g1u3ar,No evidence of clinical efficacy of hydroxychloroquine in patients hospitalized for COVID-19 infection with oxygen requirement: results of a study using routinely collected data to emulate a target trial,3,2020-04-15 15:27:40
81,CoronavirusUK,g1u3yl,"Long-term recovery (fatigue, mild symptoms)",11,2020-04-15 15:28:35
82,CoronavirusUS,g1u476,"Arizona-based Facebook group ""Great 48!"" has almost 6,000 members and is advocating for Arizona to be ""re-opened""",4,2020-04-15 15:28:56
83,CoronavirusNewYork,g1u553,"Five months on, what scientists now know about the coronavirus | World news | The Guardian",4,2020-04-15 15:30:14
84,CoronavirusUS,g1u6gz,"More than 600,000 people sign petition demanding hazard pay for U.S. Postal Service employees",1078,2020-04-15 15:32:03
85,CoronavirusUK,g1u7no,Has a lockdown extension been confirmed?,4,2020-04-15 15:33:42
86,CoronavirusNewYork,g1u9jh,Loving this video by the FDNY thanking our health care workers. #newyorktough,6,2020-04-15 15:36:16
87,CoronavirusNewYork,g1u9os,"Social distancing may be necessary until 2022 unless a treatment or vaccine is developed, study says (link to peer reviewed journal)",0,2020-04-15 15:36:26
88,CoronavirusUS,g1uaye,(US) US Has Seen a Steady Decline in the Rate of New Deaths Across the Last 3 1/2 Weeks,5,2020-04-15 15:38:15
89,CoronavirusNewYork,g1udvo,"Most New York City children 'probably' have coronavirus, doc says",63,2020-04-15 15:42:08
90,CoronavirusUS,g1ue5q,"Regarding the public statement for collaboration on COVID-19 vaccine development-Trump says he is halting funding for the WHO.. result sharing agreements like this would be something US would miss out on, if future disasters like this happen . Is politics turning in to be the real problem?",4,2020-04-15 15:42:28
91,CoronavirusUS,g1ugoy,Will I receive a stimulus check as a 20 year old living with my parents?,3,2020-04-15 15:46:01
92,CoronavirusCA,g1uho2,Place to donate stimulus check?,236,2020-04-15 15:47:19
93,CoronavirusUK,g1ul8a,"With fear and trepidation, Europe leaves coronavirus lockdown",0,2020-04-15 15:52:28
94,CoronavirusUS,g1um1r,Kinda confused about my test results,5,2020-04-15 15:53:36
95,CoronavirusUS,g1umye,Have you pressed a personal goal since lockdown?,6,2020-04-15 15:54:55
96,CoronavirusUS,g1usmb,Has anyone started a new hobby or picked up an old one that they didnt have time for? Or can suggest a good beginner hobby to pass the time?,9,2020-04-15 16:02:30
97,CoronavirusUK,g1utg3,'Blanket' use of Do Not Resuscitate notices in care homes forbidden,28,2020-04-15 16:03:42
98,CoronavirusUS,g1uy8l,Do you think President Trump took the right decision to stop funding WHO? (US),18,2020-04-15 16:10:16
99,CoronavirusUS,g1v2od,Harvard Researchers Say Some Social Distancing May Be Needed Into 2022,3,2020-04-15 16:16:33
100,CoronavirusUS,g1v36p,Trump's halt to WHO funding prompts condemnation as coronavirus cases pass 2 million,5,2020-04-15 16:17:21
101,CoronavirusNewYork,g1v3wh,“The fastest an answer can possibly come we think is in two months.” : US clinical trials of hydroxychloroquine hit 'warp speed',2,2020-04-15 16:18:22
102,CoronavirusUS,g1v4kl,And so it begins...,1,2020-04-15 16:19:22
103,CoronavirusUK,g1v4n6,Global death comparison (starting when each nation had 50 deaths),3,2020-04-15 16:19:29
104,CoronavirusNewYork,g1v52o,New York State Unemployment Call Back info,1,2020-04-15 16:20:07
105,CoronavirusUK,g1t0mu,How COVID-19 Immunity Testing Can Help People Get Back To Work,1,2020-04-15 14:31:38
106,CoronavirusUK,g1tas2,Hackers Leak Thousands of Coronavirus Research Papers,20,2020-04-15 14:46:45
107,CoronavirusUK,g1tcx7,A nice metaphor regarding the logic of easing the lockdown,32,2020-04-15 14:49:58
108,CoronavirusUK,g1tdwl,"April 15 NHS England deaths by actual day chart, now including ONS data",84,2020-04-15 14:51:24
109,CoronavirusUS,g1tssy,2k Monthly Stimulus Check Proposal... Wishful thinking?,9,2020-04-15 15:12:37
110,CoronavirusUS,g1tu7j,(US) Is there a website to anonymously name companies who screw/take advantage of workers during the outbreak?,100,2020-04-15 15:14:36
111,CoronavirusUK,g1tuvi,I've just received a letter (dated 23 March!) stating I am 'at a higher risk' due to health conditions etc. This is jointly from my council and CCG. Does this mean I'm in the shielding group or did they send letters to the vunerable group (i.e. the flu shot lot) as well. I'm confused.,11,2020-04-15 15:15:35
112,CoronavirusUS,g1twfu,Stimulus Check could be delayed so that Trump’s name can be printed on them.,34,2020-04-15 15:17:52
113,CoronavirusNewYork,g1tz1o,Why stock-market investors may be asking the ‘wrong question’ about coronavirus and reopening the economy - MarketWatch,3,2020-04-15 15:21:43
114,CoronavirusCA,g1u042,What do you think of this article saying we possibly will social distance until 2022?,18,2020-04-15 15:23:09
115,CoronavirusUS,g1u3ar,No evidence of clinical efficacy of hydroxychloroquine in patients hospitalized for COVID-19 infection with oxygen requirement: results of a study using routinely collected data to emulate a target trial,3,2020-04-15 15:27:40
116,CoronavirusUK,g1u3yl,"Long-term recovery (fatigue, mild symptoms)",13,2020-04-15 15:28:35
117,CoronavirusUS,g1u476,"Arizona-based Facebook group ""Great 48!"" has almost 6,000 members and is advocating for Arizona to be ""re-opened""",4,2020-04-15 15:28:56
118,CoronavirusNewYork,g1u553,"Five months on, what scientists now know about the coronavirus | World news | The Guardian",3,2020-04-15 15:30:14
119,CoronavirusUS,g1u6gz,"More than 600,000 people sign petition demanding hazard pay for U.S. Postal Service employees",1079,2020-04-15 15:32:03
120,CoronavirusUK,g1u7no,Has a lockdown extension been confirmed?,4,2020-04-15 15:33:42
121,CoronavirusNewYork,g1u9jh,Loving this video by the FDNY thanking our health care workers. #newyorktough,4,2020-04-15 15:36:16
122,CoronavirusNewYork,g1u9os,"Social distancing may be necessary until 2022 unless a treatment or vaccine is developed, study says (link to peer reviewed journal)",0,2020-04-15 15:36:26
123,CoronavirusUS,g1uaye,(US) US Has Seen a Steady Decline in the Rate of New Deaths Across the Last 3 1/2 Weeks,4,2020-04-15 15:38:15
124,CoronavirusUK,g1udlj,Three-week extension to NI coronavirus lockdown,22,2020-04-15 15:41:46
125,CoronavirusNewYork,g1udvo,"Most New York City children 'probably' have coronavirus, doc says",64,2020-04-15 15:42:08
126,CoronavirusUS,g1ue5q,"Regarding the public statement for collaboration on COVID-19 vaccine development-Trump says he is halting funding for the WHO.. result sharing agreements like this would be something US would miss out on, if future disasters like this happen . Is politics turning in to be the real problem?",5,2020-04-15 15:42:28
127,CoronavirusCA,g1uho2,Place to donate stimulus check?,237,2020-04-15 15:47:19
128,CoronavirusUK,g1ul8a,"With fear and trepidation, Europe leaves coronavirus lockdown",0,2020-04-15 15:52:28
129,CoronavirusUS,g1um1r,Kinda confused about my test results,4,2020-04-15 15:53:36
130,CoronavirusUS,g1umye,Have you pressed a personal goal since lockdown?,6,2020-04-15 15:54:55
131,CoronavirusUS,g1usmb,Has anyone started a new hobby or picked up an old one that they didnt have time for? Or can suggest a good beginner hobby to pass the time?,10,2020-04-15 16:02:30
132,CoronavirusUK,g1utg3,'Blanket' use of Do Not Resuscitate notices in care homes forbidden,26,2020-04-15 16:03:42
133,CoronavirusUS,g1uy8l,Do you think President Trump took the right decision to stop funding WHO? (US),18,2020-04-15 16:10:16
134,CoronavirusUS,g1v36p,Trump's halt to WHO funding prompts condemnation as coronavirus cases pass 2 million,4,2020-04-15 16:17:21
135,CoronavirusNewYork,g1v3wh,“The fastest an answer can possibly come we think is in two months.” : US clinical trials of hydroxychloroquine hit 'warp speed',2,2020-04-15 16:18:22
136,CoronavirusUK,g1v4n6,Global death comparison (starting when each nation had 50 deaths),3,2020-04-15 16:19:29
137,CoronavirusNewYork,g1v52o,New York State Unemployment Call Back info,1,2020-04-15 16:20:07
138,CoronavirusUK,g1t0mu,How COVID-19 Immunity Testing Can Help People Get Back To Work,1,2020-04-15 14:31:38
139,CoronavirusUK,g1tas2,Hackers Leak Thousands of Coronavirus Research Papers,22,2020-04-15 14:46:45
140,CoronavirusCA,g1v8mz,"I made a graph of California’s total deaths, where I looked at the overall number’s growth percentage day over day.",10,2020-04-15 16:25:29
141,CoronavirusNewYork,g1vapp,NYC may return to ‘normal’ by September: de Blasio - New York Daily News,7,2020-04-15 16:28:29
142,CoronavirusNewYork,g1ve2k,"Trump Cancels W.H.O. Coronavirus funding, 2,011,000 COVID-19 Cases!",0,2020-04-15 16:33:21
143,CoronavirusUS,g1vh8d,US Treasury okay's Banks seizing stimulus check funds in order to pay debts.,14,2020-04-15 16:37:53
144,CoronavirusUK,g1vmpk,Labour leader Sir Keir Starmer wants lockdown exit strategy revealed this week,0,2020-04-15 16:45:41
145,CoronavirusUS,g1vn59,New York City struggles to get accurate coronavirus fatality count as more people die at home,13,2020-04-15 16:46:19
146,CoronavirusUK,g1vsd5,When is ASDA Least Busy?,2,2020-04-15 16:53:46
147,CoronavirusUS,g1vtgz,IRS Get Payment Feature - Not recognizing my 2018 or 2019 tax information???,7,2020-04-15 16:55:15
148,CoronavirusCA,g1vtlg,California Releases Post-Coronavirus Plan for Restaurants | Food & Wine,38,2020-04-15 16:55:23
149,CoronavirusUK,g1w1sd,Ocado delivery slots. Tomorrow,5,2020-04-15 17:06:28
150,CoronavirusUS,g1w1xb,NC Small Business owners protest against containment measures. The sad truth may be that it's not the measures that keep their businesses shut or down. Till consumers feel confident it's safe to get back to normal many SBs will have no customers. And that may be for a LONG time from now,28,2020-04-15 17:06:39
151,CoronavirusUK,g1w68v,Coronavirus lockdown end in sight! Expert reveals huge boost in UK battle,0,2020-04-15 17:12:47
152,CoronavirusNewYork,g1w6n3,Invite a goat to your corporate meeting to help out a farm,7,2020-04-15 17:13:24
153,CoronavirusCA,g1wdog,Per the request...I’ve mapped the daily ‘percentage day over day increase in total deaths’ <orange line> and ‘daily death number’ <blue bars> (5 day average to smooth data),27,2020-04-15 17:23:33
154,CoronavirusUK,g1wnb6,Great-grandma of 106 is 'UK's oldest coronavirus survivor',28,2020-04-15 17:36:44
155,CoronavirusUS,g1x1fl,US farmers estimated to lose $20 billion in 2020 due to coronavirus crisis,32,2020-04-15 17:56:14
156,CoronavirusUS,g1x5ce,Wilmington Hospital nurse walks off job after being forbidden from wearing N95 mask to treat COVID-19 patients,121,2020-04-15 18:01:15
157,CoronavirusUK,g1x8pl,Lockdown and alcohol consumption?,34,2020-04-15 18:05:34
158,CoronavirusUS,g1xdx2,Honking cars lined up for miles protesting governor Whitmer by the Capitol Building in Lansing Michigan.,29,2020-04-15 18:12:35
159,CoronavirusUS,g1xer8,"Secretary of Defense Press Conference: ""On the T.R., of 585 sailors, only 213 were symptomatic."" That means 63.6% of those who tested positive showed no symptoms.",35,2020-04-15 18:13:46
160,CoronavirusUS,g1xhd3,My payment status is not available on the irs website. Am i not eligible then?,3,2020-04-15 18:17:28
161,CoronavirusNewYork,g1xhgo,Cuomo update summary 4/15,8,2020-04-15 18:17:34
162,CoronavirusNewYork,g1xkug,Very important Update Coronavirus in New York +7177 on 14-05,0,2020-04-15 18:22:26
163,CoronavirusUK,g1xoei,One third of NHS staff tested in the UK have coronavirus,5,2020-04-15 18:27:30
164,CoronavirusUS,g1xwxf,WHO video statement on the American directive to place WHO funding on hold.,2,2020-04-15 18:39:24
165,CoronavirusUK,g1y1qo,UK lockdown set to be extended until early May,11,2020-04-15 18:46:14
166,CoronavirusUS,g1y56z,"One month ago today, there were a total of 62 confirmed COVID-19 deaths in the U.S. -- as of right now, that number is 27,586, undoubtedly with thousands more deaths that have not been confirmed",73,2020-04-15 18:51:14
167,CoronavirusUS,g1yayn,Johnson & Johnson tries to turn vaccine development into reality TV,10,2020-04-15 18:59:16
168,CoronavirusUK,g1ydtg,"Army veteran, 99, raises £4m for 'humbled' NHS",16,2020-04-15 19:03:12
169,CoronavirusUK,g1yfob,Is it me or are a lot of people across the UK are trying to ultra-normalise this pandemic?,0,2020-04-15 19:05:39
170,CoronavirusUK,g1yg6r,Germany slowly eases lockdown measures,0,2020-04-15 19:06:20
171,CoronavirusUK,g1ym5p,"My friend is suffering from a severe case of coronavirus, what can I do to make his days a little better?",20,2020-04-15 19:14:39
172,CoronavirusCA,g1yesk,Newsome Press Conference Noon Wed. here,7,2020-04-15 19:04:29
173,CoronavirusCA,g1thut,"San Diego County officials give inconsistent, confusing COVID-19 statements",8,2020-04-15 14:57:22
174,CoronavirusCA,g1qyn8,Coronavirus vaccine update: vaccines being tested on humans says WHO,6,2020-04-15 12:27:16
175,CoronavirusCA,g1t0pz,Beware: Banks authorized to grab coronavirus stimulus checks off their customers,17,2020-04-15 14:31:46
176,CoronavirusCA,g1pe34,Anyone self-employed or contractors get unemployment benefits yet?,6,2020-04-15 10:26:23
177,CoronavirusUK,g1yqyr,"Coronavirus: Pregnant nurse, 28, dies after contracting COVID-19 - but baby survives",10,2020-04-15 19:21:30
178,CoronavirusCA,g1j008,SoCal Covid-19 Stats 4/7 - 4/13 (more in comments),10,2020-04-15 02:10:02
179,CoronavirusUK,g1ytaf,Austria reopens thousands of shops in first loosening of coronavirus lockdown,4,2020-04-15 19:24:46
180,CoronavirusUK,g1yviu,im not racist but how many people do we have in this country that could do with some extra cash. the farms are crying out for workers-lets pull together and get out there and keep Britain moving. i have applied for a number of farm jobs near me and hope to start one soon.,0,2020-04-15 19:27:56
181,CoronavirusUS,g1yxo8,COVID-19 Regional Forecast provides US-county-level statistics and a 60-day forecast of Med-Surg and ICU admissions,7,2020-04-15 19:30:58
182,CoronavirusUS,g1yz17,"Receiving SSI benefits? You will get your coronavirus stimulus payment automatically, government says",7,2020-04-15 19:32:54
