,subreddit,Pid,title,upvote,date
0,CoronavirusUS,fz5ahf,I filed with turbo tax. Where's my stimmulus going?,2,2020-04-11 13:31:11
1,CoronavirusUS,fz5b62,Washington state begins to ask: how does the coronavirus crisis end?,3,2020-04-11 13:32:12
2,CoronavirusUS,fz5d8z,Experts say there cannot be a reopening of the U.S. economy without mass testing,56,2020-04-11 13:35:19
3,CoronavirusUK,fz5gxs,Outcomes of 3883 UK Patients critically ill with confirmed COVID-19 by Age (Source Data ICNARC),24,2020-04-11 13:41:06
4,CoronavirusUK,fz5hm4,They’ve finally updated the recovery number after nearly a month,9,2020-04-11 13:42:05
5,CoronavirusUS,fz5m13,NOT REAL NEWS: A week of false news around the coronavirus pandemic,6,2020-04-11 13:48:46
6,CoronavirusUK,fz5lex,"10th April - UK's daily death toll compared with Italy's, Spain's, France's and Germany's",483,2020-04-11 13:47:52
7,CoronavirusCA,fz5vfv,50+ Artists offering their talents to provide FREE memorial portraits to families that have lost someone to covid19,43,2020-04-11 14:02:26
8,CoronavirusUK,fz5wn2,Could my housemates return(from UK),2,2020-04-11 14:04:16
9,CoronavirusUS,fz5wze,"God Bless Texas...They Tried, Epic Fail",5,2020-04-11 14:04:43
10,CoronavirusUS,fz5ygh,My grandfather has tested positive.,24,2020-04-11 14:06:50
11,CoronavirusUK,fz63d7,Has something happened to the air pressure recently due to the coronavirus?.,0,2020-04-11 14:14:09
12,CoronavirusNewYork,fz6az3,New legislation aims to cancel student debt for healthcare workers on the front line of COVID-19 - amNewYork,136,2020-04-11 14:25:41
13,CoronavirusUK,fz6fih,UK Covid-19 death tolls rise by 917 in 24 hours - including an 11-year-old,7,2020-04-11 14:32:43
14,CoronavirusNewYork,fz6i6y,NYC Schools Closed for Rest of Academic Year,7,2020-04-11 14:36:31
15,CoronavirusCA,fz6kma,IRS - Economic Impact Payment,18,2020-04-11 14:40:08
16,CoronavirusNewYork,fz6lok,Why some doctors are moving away from ventilators for virus patients,5,2020-04-11 14:41:35
17,CoronavirusUS,fz6m5v,Essential Workers,17,2020-04-11 14:42:21
18,CoronavirusUK,fz6nmu,Self employed people - has anyone received the HMRC invite for 80% income yet?,6,2020-04-11 14:44:21
19,CoronavirusUS,fz6onj,The USA is now the World leader in COVID-19 deaths.,27,2020-04-11 14:45:56
20,CoronavirusUS,fz6p4g,My Hero,36,2020-04-11 14:46:36
21,CoronavirusNewYork,fz6rs1,"New York City Mayor Bill de Blasio announces public schools will remain closed for the rest of the school year, calling it a public health decision: ""It's the right thing to do. It clearly will help us save lives.""",30,2020-04-11 14:50:18
22,CoronavirusUS,fz6tgw,Couldn't resist...,3,2020-04-11 14:52:51
23,CoronavirusUS,fz6u4z,"Michigan now has more coronavirus deaths than Illinois, Ohio, and Wisconsin combined",33,2020-04-11 14:53:40
24,CoronavirusUK,fz75tw,Lock down strategy comparison of countries,0,2020-04-11 15:09:19
25,CoronavirusUS,fz7any,Kansas Republicans Undo Governor’s Coronavirus Order Prohibiting Large Religious Gatherings Kansas will allow church services to be held on Easter Sunday after the Legislature overturned the governor’s prohibition on large religious gatherings.,7,2020-04-11 15:16:07
26,CoronavirusUS,fz7csu,"When all of this is over, how will you people celebrate?",10,2020-04-11 15:19:17
27,CoronavirusUS,fz7fi4,Interesting article from a N.Y. Paramedic,12,2020-04-11 15:23:06
28,CoronavirusUS,fz7hx6,social distancing is somewhat useless unless people start wearing masks... disturbing video by researchers in Finland shows why,8,2020-04-11 15:26:30
29,CoronavirusUK,fz7i0k,'Crazy' town relieves lockdown with mass mooing,17,2020-04-11 15:26:38
30,CoronavirusUS,fz7k5w,"Watch Now : Trump: ""We have to get our country open."" Question: ""Will you say, sir, what metrics you will use to make that decision?"" Trump: ""The metric's right here."" [Points to head]",102,2020-04-11 15:29:42
31,CoronavirusUS,fz7lpe,Walmart CEO says we're in the 'hair color' phase of panic buying,57,2020-04-11 15:31:54
32,CoronavirusNewYork,fz7n06,Has anyone received any calls yet?,3,2020-04-11 15:33:34
33,CoronavirusNewYork,fz7qan,Coronavirus in New York: Latest Updates,4,2020-04-11 15:38:03
34,CoronavirusUK,fz7sc1,Force removal of Early Termination Clauses?,2,2020-04-11 15:40:40
35,CoronavirusUS,fz7uo6,"A plan to defeat coronavirus finally emerges, but it’s not from the White House",0,2020-04-11 15:43:39
36,CoronavirusUS,fz7wib,Help Relaying the Message,0,2020-04-11 15:46:03
37,CoronavirusUS,fz7yek,When does this end? Open up colleges?,0,2020-04-11 15:48:25
38,CoronavirusUK,fz7ysz,Facing a huge moral dilemma and need help,15,2020-04-11 15:48:56
39,CoronavirusUS,fz85ik,Indiana government count of COVID-19 deaths versus John Hopkins dataset,10,2020-04-11 15:57:46
40,CoronavirusUS,fz88ds,Belgian study on safe distancing while exercising,1,2020-04-11 16:01:27
41,CoronavirusUS,fz8c5f,How can the Coronavirus pandemic end?,0,2020-04-11 16:06:08
42,CoronavirusNewYork,fz8che,[OC] 11 April 2020 | Top Countries according to deaths per million people,2,2020-04-11 16:06:34
43,CoronavirusUS,fz8dho,South Korea says recovereed patients re-testing positive,27,2020-04-11 16:07:54
44,CoronavirusUS,fz8fov,Stimulus package,895,2020-04-11 16:10:38
45,CoronavirusNewYork,fz8h9h,Coronavirus: NYC public schools will remain closed for rest of year,4,2020-04-11 16:12:35
46,CoronavirusCA,fz8jpa,"Marin County is reporting 6% mortality rate on 153 positive cases. They’ve only tested 2047 people 258,826 of the counties residents. Additionally the county announced on March 23rd their Public Health Officer, Matt Willis, tested positive for community acquired COVID.",153,2020-04-11 16:15:49
47,CoronavirusUK,fz8mki,Coronavirus mutated into three distinct strains as it spread across the world | Metro News,2,2020-04-11 16:19:35
48,CoronavirusUS,fz8q9u,"Marin seniors’ center reports coronavirus outbreak: 1 dead, 6 others infected 100 residents housed at facility.",9,2020-04-11 16:24:18
49,CoronavirusUS,fz8uec,How long does the corona virus stay on fabric? Like couches.,7,2020-04-11 16:29:57
50,CoronavirusNewYork,fz8vnk,Cuomo update summary 4/11,11,2020-04-11 16:31:35
51,CoronavirusUS,fz8xmq,This here is why it is going to continue to get worse for the US. I'm all for religious freedom and expression but thousands of people could and likely will get sick because of this.,22,2020-04-11 16:34:04
52,CoronavirusNewYork,fz8zlr,"Coronavirus Lockdown Is A Globalists' Dream, 1,719,000 COVID-19 Cases",0,2020-04-11 16:36:43
53,CoronavirusUS,fz90tr,No fever a good sign for Covid-19?,9,2020-04-11 16:38:20
54,CoronavirusUK,fz90z5,Does anyone know anything about year 10??,1,2020-04-11 16:38:34
55,CoronavirusUK,fz93pv,Stats 11/04,25,2020-04-11 16:42:10
56,CoronavirusCA,fz9amb,A new East Sacramento doughnut shop opened amid the coronavirus pandemic. And sold out twice,24,2020-04-11 16:51:14
57,CoronavirusNewYork,fz9hl7,"""How You Save A Life"" - YouTube",1,2020-04-11 16:57:16
58,CoronavirusCA,fz9ik4,"SIP shutters guide dog trainers for the blind and disabled, including in Santa Rosa",7,2020-04-11 16:57:56
59,CoronavirusUS,fz9ngs,How might the Coronavirus affect buying foreign vehicles?,0,2020-04-11 17:01:00
60,CoronavirusUK,fz9sf5,Every benefit of a homemade mask explained. Still hoping to see these encouraged in the UK soon,14,2020-04-11 17:04:01
61,CoronavirusUS,fza3kg,hey guys,0,2020-04-11 17:11:10
62,CoronavirusUS,fzb9u5,"Dwayne ""The Rock"" Johnson Live On Instagram with Gavin Newsom — (10/04/2020)",0,2020-04-11 17:45:29
63,CoronavirusUS,fzbbt6,CDC: Hospitalization Rates and Characterizations of Patients Hospitalized,3,2020-04-11 17:46:43
64,CoronavirusUK,fzbe8q,UK hunger crisis: 1.5m people go whole day without food,9,2020-04-11 17:48:13
65,CoronavirusNewYork,fzbg80,Updated per capita Chart of NY State Counties' Confirmed Cases,7,2020-04-11 17:49:26
66,CoronavirusUS,fzbhrp,Prepare for the Ultimate Gaslighting,71,2020-04-11 17:50:25
67,CoronavirusUS,fzblbq,Is the High Blood Pressure risk factor mitigated by treatment?,4,2020-04-11 17:52:46
68,CoronavirusCA,fzbpfy,Evidence Mounting Showing COVID-19 Was Prevalent In Some California Communities As Early As January,94,2020-04-11 17:55:20
69,CoronavirusUK,fzbpzw,Simple message,127,2020-04-11 17:55:37
70,CoronavirusUK,fzbtez,Covid-19 patients are being transferred to care homes with healthy residents.,55,2020-04-11 17:57:46
71,CoronavirusUS,fzbv2s,"Ya hate to see it, this is project mockingbird.",3,2020-04-11 17:58:49
72,CoronavirusUS,fzc46q,Stimulus check assistance. No longer have access to the bank I used for my last two tax returns.,3,2020-04-11 18:04:33
73,CoronavirusUS,fzc93j,Fire chief: Milford PPEs taken by feds amid coronavirus crisis,18,2020-04-11 18:07:40
74,CoronavirusUS,fzcbdy,Why wear a mask? Every Benefit of a cloth mask summarised. (Homemade & CDC pattern),19,2020-04-11 18:09:05
75,CoronavirusUS,fzchfv,Stupid-looking but effective face mask my friends and I made we are donating to health care workers,4,2020-04-11 18:12:58
76,CoronavirusNewYork,fzcl1q,The New York Times Just Published Documents Showing Trump’s COVID-19 Response Was Worse Than We Knew,26,2020-04-11 18:15:36
77,CoronavirusUS,fzcm04,FDA To Alex Jones: Stop Selling Fake Coronavirus Cures,13,2020-04-11 18:16:14
78,CoronavirusUK,fzcps5,Location Map of Countries Without Confirmed Covid-19 Cases,0,2020-04-11 18:18:44
79,CoronavirusNewYork,fzczwk,New York doctor gambles on clot-busting drug to save coronavirus patients,4,2020-04-11 18:25:22
80,CoronavirusUK,fzd0zg,Deaths per million comparison including USA (5 day rolling mean),0,2020-04-11 18:26:02
81,CoronavirusUS,fzd65z,Close family member just received official results. What the hell does this even mean? Quest did the test.,9,2020-04-11 18:29:29
82,CoronavirusUK,fzdml0,Use of masks/ respirators on trains,5,2020-04-11 18:40:01
83,CoronavirusCA,fzdqlm,Coronavirus: San Bernardino and Riverside counties pivot to allow drive-up religious services through Easter - News - vvdailypress.com,8,2020-04-11 18:42:39
84,CoronavirusUS,fze7u8,How can I safely ship out any masks I sew?,3,2020-04-11 18:54:01
85,CoronavirusUK,fze9p3,China clamping down on coronavirus research,4,2020-04-11 18:55:12
86,CoronavirusCA,fzebjx,Driving from California to Washington for work concerns,4,2020-04-11 18:56:20
87,CoronavirusUS,fzeeeb,Today I actually met a guy who believes this is all a hoax.,36,2020-04-11 18:58:18
88,CoronavirusNewYork,fzef1a,South Korea says recovered COVID-19 patients re-testing positive,5,2020-04-11 18:58:41
89,CoronavirusUS,fzefa8,USA #1 in cases and deaths.,5,2020-04-11 18:58:48
90,CoronavirusCA,fzemdx,"Dwayne ""The Rock"" Johnson Live On Instagram with Gavin Newsom — (10/04/2020)",2,2020-04-11 19:03:15
91,CoronavirusUS,fzf7hr,"Stimulus checks, tax question",3,2020-04-11 19:16:52
92,CoronavirusCA,fzfefn,Here’s How Apple and Google Plan to Track the Coronavirus Through Your Phone,2,2020-04-11 19:21:16
93,CoronavirusNewYork,fzffun,Here’s How Apple and Google Plan to Track the Coronavirus Through Your Phone,2,2020-04-11 19:22:11
94,CoronavirusUS,fzfio8,"Navajo Nation low on water, approaching top 3 hot spots in US",8,2020-04-11 19:23:57
95,CoronavirusUK,fzflus,"FFS even a documentary is getting slammed by the press. Fair play to Ross, must be a huge risk",6,2020-04-11 19:25:59
96,CoronavirusUK,fzfskn,UK Coronavirus Death Toll comparing with other countries (Updated),1,2020-04-11 19:30:22
97,CoronavirusNewYork,fzfsvd,Gov. Cuomo: There’s a Spread of the Coronavirus in the Suburban Communities Around New York City,6,2020-04-11 19:30:34
98,CoronavirusNewYork,fzg4q1,How fast does Coronavirus spread? ( Confirmed cases comparison ),1,2020-04-11 19:38:10
99,CoronavirusUK,fzg4yv,"Chart of UK hospital deaths to 10th April, log scaling",5,2020-04-11 19:38:22
100,CoronavirusNewYork,fzgj7b,x Cuomo Says New York Mayor Doesn’t Have the Authority to Keep Schools Closed,1,2020-04-11 19:47:36
101,CoronavirusUK,fzgkvl,Coronavirus lockdown until June could save every UK household hundreds of pounds,22,2020-04-11 19:48:40
102,CoronavirusNewYork,fzgl7i,Cuomo Says New York Mayor Doesn’t Have the Authority to Keep Schools Closed,2,2020-04-11 19:48:55
103,CoronavirusUS,fz5d8z,Experts say there cannot be a reopening of the U.S. economy without mass testing,55,2020-04-11 13:35:19
104,CoronavirusUK,fz5gxs,Outcomes of 3883 UK Patients critically ill with confirmed COVID-19 by Age (Source Data ICNARC),26,2020-04-11 13:41:06
105,CoronavirusUK,fz5hm4,They’ve finally updated the recovery number after nearly a month,10,2020-04-11 13:42:05
106,CoronavirusUS,fz5m13,NOT REAL NEWS: A week of false news around the coronavirus pandemic,7,2020-04-11 13:48:46
107,CoronavirusUK,fz5lex,"10th April - UK's daily death toll compared with Italy's, Spain's, France's and Germany's",476,2020-04-11 13:47:52
108,CoronavirusCA,fz5vfv,50+ Artists offering their talents to provide FREE memorial portraits to families that have lost someone to covid19,46,2020-04-11 14:02:26
109,CoronavirusUK,fz5wn2,Could my housemates return(from UK),1,2020-04-11 14:04:16
110,CoronavirusUS,fz5wze,"God Bless Texas...They Tried, Epic Fail",5,2020-04-11 14:04:43
111,CoronavirusUS,fz5ygh,My grandfather has tested positive.,25,2020-04-11 14:06:50
112,CoronavirusUK,fz63d7,Has something happened to the air pressure recently due to the coronavirus?.,0,2020-04-11 14:14:09
113,CoronavirusNewYork,fz6az3,New legislation aims to cancel student debt for healthcare workers on the front line of COVID-19 - amNewYork,137,2020-04-11 14:25:41
114,CoronavirusUK,fz6fih,UK Covid-19 death tolls rise by 917 in 24 hours - including an 11-year-old,8,2020-04-11 14:32:43
115,CoronavirusNewYork,fz6i6y,NYC Schools Closed for Rest of Academic Year,6,2020-04-11 14:36:31
116,CoronavirusCA,fz6kma,IRS - Economic Impact Payment,20,2020-04-11 14:40:08
117,CoronavirusNewYork,fz6lok,Why some doctors are moving away from ventilators for virus patients,6,2020-04-11 14:41:35
118,CoronavirusUS,fz6m5v,Essential Workers,15,2020-04-11 14:42:21
119,CoronavirusUK,fz6nmu,Self employed people - has anyone received the HMRC invite for 80% income yet?,6,2020-04-11 14:44:21
120,CoronavirusUS,fz6onj,The USA is now the World leader in COVID-19 deaths.,31,2020-04-11 14:45:56
121,CoronavirusUS,fz6p4g,My Hero,36,2020-04-11 14:46:36
122,CoronavirusNewYork,fz6rs1,"New York City Mayor Bill de Blasio announces public schools will remain closed for the rest of the school year, calling it a public health decision: ""It's the right thing to do. It clearly will help us save lives.""",28,2020-04-11 14:50:18
123,CoronavirusUS,fz6tgw,Couldn't resist...,3,2020-04-11 14:52:51
124,CoronavirusUS,fz6u4z,"Michigan now has more coronavirus deaths than Illinois, Ohio, and Wisconsin combined",35,2020-04-11 14:53:40
125,CoronavirusUK,fz75tw,Lock down strategy comparison of countries,0,2020-04-11 15:09:19
126,CoronavirusUS,fz7any,Kansas Republicans Undo Governor’s Coronavirus Order Prohibiting Large Religious Gatherings Kansas will allow church services to be held on Easter Sunday after the Legislature overturned the governor’s prohibition on large religious gatherings.,6,2020-04-11 15:16:07
127,CoronavirusUS,fz7csu,"When all of this is over, how will you people celebrate?",10,2020-04-11 15:19:17
128,CoronavirusUS,fz7fi4,Interesting article from a N.Y. Paramedic,12,2020-04-11 15:23:06
129,CoronavirusUS,fz7hx6,social distancing is somewhat useless unless people start wearing masks... disturbing video by researchers in Finland shows why,9,2020-04-11 15:26:30
130,CoronavirusUK,fz7i0k,'Crazy' town relieves lockdown with mass mooing,17,2020-04-11 15:26:38
131,CoronavirusUS,fz7k5w,"Watch Now : Trump: ""We have to get our country open."" Question: ""Will you say, sir, what metrics you will use to make that decision?"" Trump: ""The metric's right here."" [Points to head]",100,2020-04-11 15:29:42
132,CoronavirusUS,fz7lpe,Walmart CEO says we're in the 'hair color' phase of panic buying,53,2020-04-11 15:31:54
133,CoronavirusNewYork,fz7n06,Has anyone received any calls yet?,4,2020-04-11 15:33:34
134,CoronavirusNewYork,fz7qan,Coronavirus in New York: Latest Updates,5,2020-04-11 15:38:03
135,CoronavirusUK,fz7sc1,Force removal of Early Termination Clauses?,1,2020-04-11 15:40:40
136,CoronavirusUS,fz7uo6,"A plan to defeat coronavirus finally emerges, but it’s not from the White House",0,2020-04-11 15:43:39
137,CoronavirusUS,fz7wib,Help Relaying the Message,0,2020-04-11 15:46:03
138,CoronavirusUS,fz7yek,When does this end? Open up colleges?,0,2020-04-11 15:48:25
139,CoronavirusUK,fz7ysz,Facing a huge moral dilemma and need help,15,2020-04-11 15:48:56
140,CoronavirusUS,fz85ik,Indiana government count of COVID-19 deaths versus John Hopkins dataset,8,2020-04-11 15:57:46
141,CoronavirusUS,fz88ds,Belgian study on safe distancing while exercising,1,2020-04-11 16:01:27
142,CoronavirusUS,fz8c5f,How can the Coronavirus pandemic end?,0,2020-04-11 16:06:08
143,CoronavirusNewYork,fz8che,[OC] 11 April 2020 | Top Countries according to deaths per million people,2,2020-04-11 16:06:34
144,CoronavirusUS,fz8dho,South Korea says recovereed patients re-testing positive,28,2020-04-11 16:07:54
145,CoronavirusUS,fz8fov,Stimulus package,902,2020-04-11 16:10:38
146,CoronavirusNewYork,fz8h9h,Coronavirus: NYC public schools will remain closed for rest of year,4,2020-04-11 16:12:35
147,CoronavirusCA,fz8jpa,"Marin County is reporting 6% mortality rate on 153 positive cases. They’ve only tested 2047 people 258,826 of the counties residents. Additionally the county announced on March 23rd their Public Health Officer, Matt Willis, tested positive for community acquired COVID.",155,2020-04-11 16:15:49
148,CoronavirusUK,fz8mki,Coronavirus mutated into three distinct strains as it spread across the world | Metro News,1,2020-04-11 16:19:35
149,CoronavirusUS,fz8q9u,"Marin seniors’ center reports coronavirus outbreak: 1 dead, 6 others infected 100 residents housed at facility.",8,2020-04-11 16:24:18
150,CoronavirusUS,fz8uec,How long does the corona virus stay on fabric? Like couches.,7,2020-04-11 16:29:57
151,CoronavirusNewYork,fz8vnk,Cuomo update summary 4/11,11,2020-04-11 16:31:35
152,CoronavirusUS,fz8xmq,This here is why it is going to continue to get worse for the US. I'm all for religious freedom and expression but thousands of people could and likely will get sick because of this.,22,2020-04-11 16:34:04
153,CoronavirusNewYork,fz8zlr,"Coronavirus Lockdown Is A Globalists' Dream, 1,719,000 COVID-19 Cases",0,2020-04-11 16:36:43
154,CoronavirusUS,fz90tr,No fever a good sign for Covid-19?,10,2020-04-11 16:38:20
155,CoronavirusUK,fz90z5,Does anyone know anything about year 10??,1,2020-04-11 16:38:34
156,CoronavirusUK,fz93pv,Stats 11/04,26,2020-04-11 16:42:10
157,CoronavirusCA,fz9amb,A new East Sacramento doughnut shop opened amid the coronavirus pandemic. And sold out twice,26,2020-04-11 16:51:14
158,CoronavirusNewYork,fz9hl7,"""How You Save A Life"" - YouTube",1,2020-04-11 16:57:16
159,CoronavirusCA,fz9ik4,"SIP shutters guide dog trainers for the blind and disabled, including in Santa Rosa",7,2020-04-11 16:57:56
160,CoronavirusUS,fz9ngs,How might the Coronavirus affect buying foreign vehicles?,0,2020-04-11 17:01:00
161,CoronavirusUK,fz9sf5,Every benefit of a homemade mask explained. Still hoping to see these encouraged in the UK soon,16,2020-04-11 17:04:01
162,CoronavirusUS,fza3kg,hey guys,0,2020-04-11 17:11:10
163,CoronavirusUS,fzb9u5,"Dwayne ""The Rock"" Johnson Live On Instagram with Gavin Newsom — (10/04/2020)",0,2020-04-11 17:45:29
164,CoronavirusUS,fzbbt6,CDC: Hospitalization Rates and Characterizations of Patients Hospitalized,4,2020-04-11 17:46:43
165,CoronavirusUK,fzbe8q,UK hunger crisis: 1.5m people go whole day without food,9,2020-04-11 17:48:13
166,CoronavirusNewYork,fzbg80,Updated per capita Chart of NY State Counties' Confirmed Cases,7,2020-04-11 17:49:26
167,CoronavirusUS,fzbhrp,Prepare for the Ultimate Gaslighting,74,2020-04-11 17:50:25
168,CoronavirusUS,fzblbq,Is the High Blood Pressure risk factor mitigated by treatment?,4,2020-04-11 17:52:46
169,CoronavirusCA,fzbpfy,Evidence Mounting Showing COVID-19 Was Prevalent In Some California Communities As Early As January,95,2020-04-11 17:55:20
170,CoronavirusUK,fzbpzw,Simple message,124,2020-04-11 17:55:37
171,CoronavirusUK,fzbtez,Covid-19 patients are being transferred to care homes with healthy residents.,59,2020-04-11 17:57:46
172,CoronavirusUS,fzbv2s,"Ya hate to see it, this is project mockingbird.",0,2020-04-11 17:58:49
173,CoronavirusUS,fzc46q,Stimulus check assistance. No longer have access to the bank I used for my last two tax returns.,3,2020-04-11 18:04:33
174,CoronavirusUS,fzc93j,Fire chief: Milford PPEs taken by feds amid coronavirus crisis,18,2020-04-11 18:07:40
175,CoronavirusUS,fzcbdy,Why wear a mask? Every Benefit of a cloth mask summarised. (Homemade & CDC pattern),17,2020-04-11 18:09:05
176,CoronavirusUS,fzchfv,Stupid-looking but effective face mask my friends and I made we are donating to health care workers,5,2020-04-11 18:12:58
177,CoronavirusNewYork,fzcl1q,The New York Times Just Published Documents Showing Trump’s COVID-19 Response Was Worse Than We Knew,26,2020-04-11 18:15:36
178,CoronavirusUS,fzcm04,FDA To Alex Jones: Stop Selling Fake Coronavirus Cures,13,2020-04-11 18:16:14
179,CoronavirusUK,fzcps5,Location Map of Countries Without Confirmed Covid-19 Cases,0,2020-04-11 18:18:44
180,CoronavirusNewYork,fzczwk,New York doctor gambles on clot-busting drug to save coronavirus patients,5,2020-04-11 18:25:22
181,CoronavirusUK,fzd0zg,Deaths per million comparison including USA (5 day rolling mean),0,2020-04-11 18:26:02
182,CoronavirusUS,fzd65z,Close family member just received official results. What the hell does this even mean? Quest did the test.,9,2020-04-11 18:29:29
183,CoronavirusUK,fzdml0,Use of masks/ respirators on trains,5,2020-04-11 18:40:01
184,CoronavirusCA,fzdqlm,Coronavirus: San Bernardino and Riverside counties pivot to allow drive-up religious services through Easter - News - vvdailypress.com,9,2020-04-11 18:42:39
185,CoronavirusUS,fze7u8,How can I safely ship out any masks I sew?,3,2020-04-11 18:54:01
186,CoronavirusCA,fzebjx,Driving from California to Washington for work concerns,3,2020-04-11 18:56:20
187,CoronavirusUS,fzeeeb,Today I actually met a guy who believes this is all a hoax.,37,2020-04-11 18:58:18
188,CoronavirusNewYork,fzef1a,South Korea says recovered COVID-19 patients re-testing positive,3,2020-04-11 18:58:41
189,CoronavirusUS,fzefa8,USA #1 in cases and deaths.,5,2020-04-11 18:58:48
190,CoronavirusCA,fzemdx,"Dwayne ""The Rock"" Johnson Live On Instagram with Gavin Newsom — (10/04/2020)",2,2020-04-11 19:03:15
191,CoronavirusUS,fzf7hr,"Stimulus checks, tax question",3,2020-04-11 19:16:52
192,CoronavirusCA,fzfefn,Here’s How Apple and Google Plan to Track the Coronavirus Through Your Phone,2,2020-04-11 19:21:16
193,CoronavirusNewYork,fzffun,Here’s How Apple and Google Plan to Track the Coronavirus Through Your Phone,2,2020-04-11 19:22:11
194,CoronavirusUS,fzfio8,"Navajo Nation low on water, approaching top 3 hot spots in US",7,2020-04-11 19:23:57
195,CoronavirusUK,fzflus,"FFS even a documentary is getting slammed by the press. Fair play to Ross, must be a huge risk",5,2020-04-11 19:25:59
196,CoronavirusUK,fzfskn,UK Coronavirus Death Toll comparing with other countries (Updated),1,2020-04-11 19:30:22
197,CoronavirusNewYork,fzfsvd,Gov. Cuomo: There’s a Spread of the Coronavirus in the Suburban Communities Around New York City,7,2020-04-11 19:30:34
198,CoronavirusNewYork,fzg4q1,How fast does Coronavirus spread? ( Confirmed cases comparison ),1,2020-04-11 19:38:10
199,CoronavirusUK,fzg4yv,"Chart of UK hospital deaths to 10th April, log scaling",6,2020-04-11 19:38:22
200,CoronavirusUK,fzgkvl,Coronavirus lockdown until June could save every UK household hundreds of pounds,23,2020-04-11 19:48:40
201,CoronavirusNewYork,fzgl7i,Cuomo Says New York Mayor Doesn’t Have the Authority to Keep Schools Closed,2,2020-04-11 19:48:55
202,CoronavirusUS,fzgrsl,170 New York National Guard troops and 49 U.S. soldiers are tasked of assisting NYC with the removal of the growing number of bodies of those who die alone during COVID-19,23,2020-04-11 19:53:10
203,CoronavirusNewYork,fzgxsi,Coronavirus & Highrise buildings,0,2020-04-11 19:56:59
204,CoronavirusUK,fzgxsp,Anyone got figures for adjusted daily deaths?,1,2020-04-11 19:56:59
205,CoronavirusUS,fzgzjh,Suggestions for Care Kit?,5,2020-04-11 19:58:06
206,CoronavirusUS,fzh9yp,Did anyone notice how Amazon is limiting the sale of Lysol/Clorox disinfecting wipes only to its Prime members?,0,2020-04-11 20:04:45
207,CoronavirusUS,fzhnde,"Shoutout to all healthcare team members, many of whom are often unknown/underappreciated",194,2020-04-11 20:13:27
208,CoronavirusUS,fzhtp0,"Coronavirus Research Done Too Fast Is Testing Publishing Safeguards, Bad Science Is Getting Through",3,2020-04-11 20:18:09
209,CoronavirusUK,fzhx2d,What Happens In the Wake of the COVID-19,1,2020-04-11 20:20:36
210,CoronavirusUS,fzhy6z,Data Visualisation experiment with Covid19 data,4,2020-04-11 20:21:27
211,CoronavirusUS,fzi0rm,Vocal,0,2020-04-11 20:23:19
212,CoronavirusUS,fzi1i8,Stimulus flow chart for the unemployed,5,2020-04-11 20:23:47
213,CoronavirusUS,fzi2xn,FedEx delayed my prescription delivery by 3 days. I will run out tomorrow and can't get more because the script has already been filled.,4,2020-04-11 20:24:49
214,CoronavirusUS,fzi3sy,States are bidding against each other and the federal government for important medical supplies — and it’s driving up prices,17,2020-04-11 20:25:32
215,CoronavirusUS,fzi4d5,Fake ThermoScan from china that will never exceed 37℃,42,2020-04-11 20:25:59
